Liquid I.V. Hydration Multiplier - Watermelon - Hydration Powder Packets | Electrolyte Drink Mix | Easy Open Single-Serving Stick | Non-GMO | 16 Sticks,$24.50 ,#1,https://www.amazon.com/Best-Sellers-Grocery-Gourmet-Food-Breakfast-Foods/zgbs/grocery/16310251/ref=zg_bs_nav_grocery_1
Atkins Endulge Treat Caramel Nut Chew Bar. Rich & Decadent Treat. Keto-Friendly. (5 Bars),$4.93 ,#7,https://www.amazon.com/Best-Sellers-Grocery-Gourmet-Food-Breakfast-Foods/zgbs/grocery/16310251/ref=zg_bs_nav_grocery_1
"GoGo squeeZ Fruit on the Go, Apple Apple, 3.2 oz. (20 Pouches) - Tasty Kids Applesauce Snacks Made from Apples - Gluten Free Snacks for Kids - Nut & Dairy Free - Vegan Snacks",$10.72 ,#3,https://www.amazon.com/Best-Sellers-Grocery-Gourmet-Food-Breakfast-Foods/zgbs/grocery/16310251/ref=zg_bs_nav_grocery_1
"Nature’s Bakery Whole Wheat Fig Bars, Apple Cinnamon, Real Fruit, Vegan, Non-GMO, Snack bar, 6 boxes with 6 twin packs (36 twin packs)",$7.78 ,#2,https://www.amazon.com/Best-Sellers-Grocery-Gourmet-Food-Breakfast-Foods/zgbs/grocery/16310251/ref=zg_bs_nav_grocery_1
"Nut Bars Favorites Variety Pack - Dark Chocolate Nuts and Sea Salt, Peanut Butter Dark Chocolate, Caramel Almond and Sea Salt, 12 Count (1.4 Ounce)",$12.99 ,#9,https://www.amazon.com/Best-Sellers-Grocery-Gourmet-Food-Breakfast-Foods/zgbs/grocery/16310251/ref=zg_bs_nav_grocery_1
"Nutritious Snacks to Support Energy, Chocolate Salted Caramel, Low Sugar, Gluten Free, 12 Pack (1.76 oz)",,#8,https://www.amazon.com/Best-Sellers-Grocery-Gourmet-Food-Breakfast-Foods/zgbs/grocery/16310251/ref=zg_bs_nav_grocery_1
"RXBAR, Banana Chocolate Walnut, Protein Bar, High Protein Snack, Gluten Free, 1.83 Ounce (Pack of 12)",$18.89 ,#6,https://www.amazon.com/Best-Sellers-Grocery-Gourmet-Food-Breakfast-Foods/zgbs/grocery/16310251/ref=zg_bs_nav_grocery_1
"Quaker Chewy Lower Sugar Granola Bars, 3 Flavor Variety Pack 58 Count (Pack of 1)",$12.62 ,#4,https://www.amazon.com/Best-Sellers-Grocery-Gourmet-Food-Breakfast-Foods/zgbs/grocery/16310251/ref=zg_bs_nav_grocery_1
"Quaker Instant Oatmeal Lower Sugar, 4 Flavor Variety Pack (44 Pack)",$14.44 ,#5,https://www.amazon.com/Best-Sellers-Grocery-Gourmet-Food-Breakfast-Foods/zgbs/grocery/16310251/ref=zg_bs_nav_grocery_1
,,,https://www.amazon.com/Best-Sellers-Grocery-Gourmet-Food-Breakfast-Foods/zgbs/grocery/16310251/ref=zg_bs_nav_grocery_1
"GoGo squeeZ Fruit on the Go, Apple Cinnamon, 3.2 oz. (12 Pouches) - Tasty Kids Applesauce Snacks Made from Apples & Cinnamon - Gluten Free Snacks for Kids - Nut & Dairy Free - Vegan Snacks",$6.48 ,#12,https://www.amazon.com/Best-Sellers-Grocery-Gourmet-Food-Breakfast-Foods/zgbs/grocery/16310251/ref=zg_bs_nav_grocery_1
"KIND Bars, Nuts and Spices Variety Pack, Gluten Free, Low Glycemic Index, 1.4 Ounce Bars, 12 Count",$14.22 ,#31,https://www.amazon.com/Best-Sellers-Grocery-Gourmet-Food-Breakfast-Foods/zgbs/grocery/16310251/ref=zg_bs_nav_grocery_1
"Coconut Cream Pie, Vegan Fruit & Nut Bars, 16 ct",$14.84 ,#15,https://www.amazon.com/Best-Sellers-Grocery-Gourmet-Food-Breakfast-Foods/zgbs/grocery/16310251/ref=zg_bs_nav_grocery_1
"Fiber One Chewy Bars, Oats & Chocolate, Fiber Snacks, 14.1 oz, 10 ct",$6.49 ,#22,https://www.amazon.com/Best-Sellers-Grocery-Gourmet-Food-Breakfast-Foods/zgbs/grocery/16310251/ref=zg_bs_nav_grocery_1
"That's it. Mini Fruit Bars (Variety 24 PACK) No Sugar Added, Plant-Based, Vegan & Gluten Free, Breakfast Bar, Paleo, for Children & Adults, Non GMO, Fiber (8 Blueberry, 8 Strawberry, 8 Mango)",$19.99 ,#24,https://www.amazon.com/Best-Sellers-Grocery-Gourmet-Food-Breakfast-Foods/zgbs/grocery/16310251/ref=zg_bs_nav_grocery_1
"Dole Fruit Bowls Diced Peaches in 100% Juice, Gluten Free Healthy Snack, 4 Oz, 12 Total Cups",$7.57 ,#38,https://www.amazon.com/Best-Sellers-Grocery-Gourmet-Food-Breakfast-Foods/zgbs/grocery/16310251/ref=zg_bs_nav_grocery_1
"Orgain Organic Plant Based Protein Bar, Peanut Butter - 10g of Protein, Vegan, Gluten Free, Non Dairy, Soy Free, Lactose Free, Kosher, Non-GMO, 1.41 Ounce, 12 Count (Packaging May Vary)",$17.99 ,#39,https://www.amazon.com/Best-Sellers-Grocery-Gourmet-Food-Breakfast-Foods/zgbs/grocery/16310251/ref=zg_bs_nav_grocery_1
"KIND Bars, Dark Chocolate Cherry Cashew + Antioxidants, Gluten Free, 1.4 Ounce (12 Count)",$13.99 ,#44,https://www.amazon.com/Best-Sellers-Grocery-Gourmet-Food-Breakfast-Foods/zgbs/grocery/16310251/ref=zg_bs_nav_grocery_1
"Magic Spoon Cereal, Cocoa 4-Pack - Keto, Gluten & Grain Free, Low Carb, High Protein, Zero Sugar, Non-GMO Breakfast Cereal",$43.99 ,#18,https://www.amazon.com/Best-Sellers-Grocery-Gourmet-Food-Breakfast-Foods/zgbs/grocery/16310251/ref=zg_bs_nav_grocery_1
"Instant Oatmeal Lower Sugar, 4 Flavor Variety Pack, 35% less Sugar (44 Pack)",$7.79 ,#17,https://www.amazon.com/Best-Sellers-Grocery-Gourmet-Food-Breakfast-Foods/zgbs/grocery/16310251/ref=zg_bs_nav_grocery_1
"KIND Nut Bars Favorites Variety Pack, 1.4 Ounce, 12 Count, Dark Chocolate Nuts and Sea Salt, Peanut Butter Dark Chocolate, Caramel Almond and Sea Salt",$14.22 ,#36,https://www.amazon.com/Best-Sellers-Grocery-Gourmet-Food-Breakfast-Foods/zgbs/grocery/16310251/ref=zg_bs_nav_grocery_1
"Nutella Chocolate Hazelnut Spread, Perfect Topping for Easter Treats, 26.5 oz (Packaging May Vary)",$6.94 ,#33,https://www.amazon.com/Best-Sellers-Grocery-Gourmet-Food-Breakfast-Foods/zgbs/grocery/16310251/ref=zg_bs_nav_grocery_1
"NuGo Dark Chocolate Chocolate Chip, 12g Vegan Protein, 200 Calories, Gluten Free, 12 Count",$17.65 ,#45,https://www.amazon.com/Best-Sellers-Grocery-Gourmet-Food-Breakfast-Foods/zgbs/grocery/16310251/ref=zg_bs_nav_grocery_1
"think! Protein Bars, High Protein Snacks, Gluten Free, Sugar Free Energy Bar with Whey Protein Isolate, Brownie Crunch, Nutrition Bars without Artificial Sweeteners, 2.1 Oz (10 Count)",$14.98 ,#27,https://www.amazon.com/Best-Sellers-Grocery-Gourmet-Food-Breakfast-Foods/zgbs/grocery/16310251/ref=zg_bs_nav_grocery_1
Sugar-Free Concord Grape Low Calories Powdered Drink Mix 6 Count Pitcher Packets,$0.99 ,#35,https://www.amazon.com/Best-Sellers-Grocery-Gourmet-Food-Breakfast-Foods/zgbs/grocery/16310251/ref=zg_bs_nav_grocery_1
"Nutella Chocolate Hazelnut Spread, Friends Edition, Perfect Easter Basket Stuffers for Kids, 1.05 oz each, 21-Count",$8.79 ,#46,https://www.amazon.com/Best-Sellers-Grocery-Gourmet-Food-Breakfast-Foods/zgbs/grocery/16310251/ref=zg_bs_nav_grocery_1
"Bob's Red Mill Organic Extra Thick Rolled Oats, 32-ounce (Pack of 4)",$15.52 ,#34,https://www.amazon.com/Best-Sellers-Grocery-Gourmet-Food-Breakfast-Foods/zgbs/grocery/16310251/ref=zg_bs_nav_grocery_1
"Cashew Cookie - Gluten Free Vegan Fruit & Nut Bar, 1.7 oz Bars, 16 Count (Pack of 1)",$10.96 ,#10,https://www.amazon.com/Best-Sellers-Grocery-Gourmet-Food-Breakfast-Foods/zgbs/grocery/16310251/ref=zg_bs_nav_grocery_1
"Quaker Instant Oatmeal Express Cups, 4 Flavor Variety Pack, 12 Count",$13.44 ,#25,https://www.amazon.com/Best-Sellers-Grocery-Gourmet-Food-Breakfast-Foods/zgbs/grocery/16310251/ref=zg_bs_nav_grocery_1
"QUAKER Instant Oatmeal, USDA Organic, Non-GMO Project Verified, 3 Flavor Variety Pack, Individual Packets, 32 Count",$15.00 ,#40,https://www.amazon.com/Best-Sellers-Grocery-Gourmet-Food-Breakfast-Foods/zgbs/grocery/16310251/ref=zg_bs_nav_grocery_1
"Honey Nut Cheerios Heart Healthy Cereal, Gluten Free Cereal With Whole Grain Oats, 10.8 oz",$3.28 ,#13,https://www.amazon.com/Best-Sellers-Grocery-Gourmet-Food-Breakfast-Foods/zgbs/grocery/16310251/ref=zg_bs_nav_grocery_1
Augason Farms Buttermilk Pancake Mix 3 lbs 4 oz #10 Can,$9.74 ,#30,https://www.amazon.com/Best-Sellers-Grocery-Gourmet-Food-Breakfast-Foods/zgbs/grocery/16310251/ref=zg_bs_nav_grocery_1
"Rice Krispies Treats Marshmallow Snack Bars, Original, Kids Snacks, School Lunch, 0.78 oz Bars (54 Bars)",$18.19 ,#21,https://www.amazon.com/Best-Sellers-Grocery-Gourmet-Food-Breakfast-Foods/zgbs/grocery/16310251/ref=zg_bs_nav_grocery_1
"SlimFast Keto Fat Bomb Meal Replacement Whey Protein Bar, Frosted Cinnamon Bun, Low Carb with 7g Protein, 5 Count Box",$8.98 ,#42,https://www.amazon.com/Best-Sellers-Grocery-Gourmet-Food-Breakfast-Foods/zgbs/grocery/16310251/ref=zg_bs_nav_grocery_1
"Propel Powder Packets 4 Flavor Variety Pack With Electrolytes, Vitamins and No Sugar 10 Count (Pack of 5) (Packaging May Vary)",$15.39 ,#16,https://www.amazon.com/Best-Sellers-Grocery-Gourmet-Food-Breakfast-Foods/zgbs/grocery/16310251/ref=zg_bs_nav_grocery_1
"Orgain Organic Plant Based Protein Bar, Chocolate Brownie - 10g of Protein, Vegan, Gluten Free, Dairy Free, Soy Free, Lactose Free, Kosher, Non-GMO, 1.41 Ounce, 12 Count (Packaging May Vary)",$15.39 ,#37,https://www.amazon.com/Best-Sellers-Grocery-Gourmet-Food-Breakfast-Foods/zgbs/grocery/16310251/ref=zg_bs_nav_grocery_1
"Original Cheerios Heart Healthy Cereal, Gluten Free Cereal with Whole Grain Oats, 12 oz",$3.98 ,#23,https://www.amazon.com/Best-Sellers-Grocery-Gourmet-Food-Breakfast-Foods/zgbs/grocery/16310251/ref=zg_bs_nav_grocery_1
"Weetabix Organic Whole Grain Cereal Biscuits, USDA Certified Organic, Non-GMO Project Verified, Heart Healthy, Kosher, Vegan, 14 Oz Box",$4.29 ,#43,https://www.amazon.com/Best-Sellers-Grocery-Gourmet-Food-Breakfast-Foods/zgbs/grocery/16310251/ref=zg_bs_nav_grocery_1
"Honey Bunches of Oats with Almonds, Heart Healthy, Low Fat, made with Whole Grain Cereal, 18 Ounce Box",$2.55 ,#14,https://www.amazon.com/Best-Sellers-Grocery-Gourmet-Food-Breakfast-Foods/zgbs/grocery/16310251/ref=zg_bs_nav_grocery_1
Atkins Endulge Treat Chocolate Coconut Bar. Rich Coconut & Decadent Chocolate. Keto-Friendly. Value Pack (10 Bars),$9.87 ,#19,https://www.amazon.com/Best-Sellers-Grocery-Gourmet-Food-Breakfast-Foods/zgbs/grocery/16310251/ref=zg_bs_nav_grocery_1
"Atkins Endulge Treat, Caramel Nut Chew Bar, Keto Friendly, 10 Count (Value Pack)",$9.33 ,#29,https://www.amazon.com/Best-Sellers-Grocery-Gourmet-Food-Breakfast-Foods/zgbs/grocery/16310251/ref=zg_bs_nav_grocery_1
"Nutri-Grain Soft Baked Breakfast Bars, 3 Flavor Variety Pack, Whole Grain Snacks, Kids Snacks (32 Bars)",$14.99 ,#32,https://www.amazon.com/Best-Sellers-Grocery-Gourmet-Food-Breakfast-Foods/zgbs/grocery/16310251/ref=zg_bs_nav_grocery_1
"Catalina Crunch Keto Protein Cereal Variety Pack (6 Flavors, Single Serve Bags) | Low Carb, Zero Sugar, Gluten Free, Fiber | Keto Snacks, Vegan Snacks, Protein Snacks | Keto Friendly Food",$6.71 ,#41,https://www.amazon.com/Best-Sellers-Grocery-Gourmet-Food-Breakfast-Foods/zgbs/grocery/16310251/ref=zg_bs_nav_grocery_1
"Carnation Breakfast Essentials Powder Drink Mix, Rich Milk Chocolate, 22 Count Box of Packets (Packaging May Vary)",$6.92 ,#11,https://www.amazon.com/Best-Sellers-Grocery-Gourmet-Food-Breakfast-Foods/zgbs/grocery/16310251/ref=zg_bs_nav_grocery_1
"Pop-Tarts Toaster Pastries, 5 Flavor Variety Pack, Breakfast Foods, Fun Snacks for Kids, 5 Boxes (60 Pop-Tarts)",$19.99 ,#20,https://www.amazon.com/Best-Sellers-Grocery-Gourmet-Food-Breakfast-Foods/zgbs/grocery/16310251/ref=zg_bs_nav_grocery_1
"Quaker Life Breakfast Cereal, 3 Flavor Variety Pack (4 Boxes)",$8.98 ,#26,https://www.amazon.com/Best-Sellers-Grocery-Gourmet-Food-Breakfast-Foods/zgbs/grocery/16310251/ref=zg_bs_nav_grocery_1
"That's it. Apple + Blueberry 100% Natural Real Fruit Bar, Best High Fiber Vegan, Gluten Free Healthy Snack, Paleo for Children & Adults, Non GMO No Sugar Added, No Preservatives Energy Food (12 Pack)",$19.99 ,#28,https://www.amazon.com/Best-Sellers-Grocery-Gourmet-Food-Breakfast-Foods/zgbs/grocery/16310251/ref=zg_bs_nav_grocery_1
"Balance Bar, Healthy Protein Snacks, Cookie Dough, With Vitamin A, Vitamin C, Vitamin D, and Zinc to Support Immune Health, 1.76 oz, Pack of Three 6-Count Boxes",$16.77 ,#57,https://www.amazon.com/Best-Sellers-Grocery-Gourmet-Food-Breakfast-Foods/zgbs/grocery/16310251/ref=zg_bs_nav_grocery_1
"Lakanto Sugar Free Maple Syrup - Monk Fruit Sweetener, Keto Diet Friendly, Vegan, 1g Net Carbs, Pancakes, Waffles, Oatmeal, Coffee, Tea, Granola, Frosting, Marinade, Dressing (13 Fl Oz - Pack of 1)",$8.98 ,#54,https://www.amazon.com/Best-Sellers-Grocery-Gourmet-Food-Breakfast-Foods/zgbs/grocery/16310251/ref=zg_bs_nav_grocery_1
"Butternut Mountain Farm Pure Vermont Maple Syrup, Grade A, Amber Color, Rich Taste, All Natural, Easy Pour Jug, 32 Fl Oz, 1 Qt",$17.26 ,#60,https://www.amazon.com/Best-Sellers-Grocery-Gourmet-Food-Breakfast-Foods/zgbs/grocery/16310251/ref=zg_bs_nav_grocery_1
"GoGo squeeZ Fruit on the Go, Apple Apple, 3.2 oz. (48 Pouches) - Tasty Kids Applesauce Snacks Made from Apples - Gluten Free Snacks for Kids - Nut & Dairy Free - Vegan Snacks",$23.92 ,#56,https://www.amazon.com/Best-Sellers-Grocery-Gourmet-Food-Breakfast-Foods/zgbs/grocery/16310251/ref=zg_bs_nav_grocery_1
"KIND Protein Bars, Almond Butter Dark Chocolate, Gluten Free, 12g Protein",$15.50 ,#51,https://www.amazon.com/Best-Sellers-Grocery-Gourmet-Food-Breakfast-Foods/zgbs/grocery/16310251/ref=zg_bs_nav_grocery_1
"Lucky Charms, Gluten Free Breakfast Cereal, 10.5 oz",$3.28 ,#55,https://www.amazon.com/Best-Sellers-Grocery-Gourmet-Food-Breakfast-Foods/zgbs/grocery/16310251/ref=zg_bs_nav_grocery_1
"Magic Spoon Cereal, Variety 8-Pack Single Serve Cups - Keto, Gluten & Grain Free, Low Carb, High Protein, Zero Sugar, Non-GMO Breakfast Cereal",$28.49 ,#58,https://www.amazon.com/Best-Sellers-Grocery-Gourmet-Food-Breakfast-Foods/zgbs/grocery/16310251/ref=zg_bs_nav_grocery_1
"Cinnamon Toast Crunch, Breakfast Cereal, Cinnamon Sugar Squares, 12 oz",$3.28 ,#53,https://www.amazon.com/Best-Sellers-Grocery-Gourmet-Food-Breakfast-Foods/zgbs/grocery/16310251/ref=zg_bs_nav_grocery_1
"Kellogg's Breakfast Cereal, Variety Pack, Kids Breakfast, Assortment Varies, Single Serve (48 Boxes)",$29.49 ,#52,https://www.amazon.com/Best-Sellers-Grocery-Gourmet-Food-Breakfast-Foods/zgbs/grocery/16310251/ref=zg_bs_nav_grocery_1
"CLIF KID ZBAR - Organic Granola Bars - Value Pack - Non-GMO - Organic -Lunch Box Snacks (1.27 Ounce Energy Bars, 36 Count)",$34.64 ,#59,https://www.amazon.com/Best-Sellers-Grocery-Gourmet-Food-Breakfast-Foods/zgbs/grocery/16310251/ref=zg_bs_nav_grocery_1
"Mrs. Butterworth's Syrup, Lite, 24 Ounce (Pack of 12)",$3.05 ,#63,https://www.amazon.com/Best-Sellers-Grocery-Gourmet-Food-Breakfast-Foods/zgbs/grocery/16310251/ref=zg_bs_nav_grocery_1
"Gluten Free Vegan Fruit & Nut Bar, 12 Count (Pack of 1)",$8.99 ,#87,https://www.amazon.com/Best-Sellers-Grocery-Gourmet-Food-Breakfast-Foods/zgbs/grocery/16310251/ref=zg_bs_nav_grocery_1
IQBAR Brain and Body Keto Protein Bars - Chocolate Lovers Variety Keto Bars - 12-Count Energy Bars - Low Carb Protein Bars - High Fiber Vegan Bars and Low Sugar Meal Replacement Bars - Vegan Snacks,$24.99 ,#79,https://www.amazon.com/Best-Sellers-Grocery-Gourmet-Food-Breakfast-Foods/zgbs/grocery/16310251/ref=zg_bs_nav_grocery_1
"Nature's Path Organic Grain Free Caramel Pecan Granola, 8 Ounce (Pack of 6), Non-GMO, Keto Friendly, Paleo Friendly, Gluten Free, 6g Plant Based Protein",$5.79 ,#95,https://www.amazon.com/Best-Sellers-Grocery-Gourmet-Food-Breakfast-Foods/zgbs/grocery/16310251/ref=zg_bs_nav_grocery_1
"Nutella & Go Snack Packs, Chocolate Hazelnut Spread with Pretzel Sticks, Perfect Easter Basket Stuffers, Pack of 12",$17.37 ,#81,https://www.amazon.com/Best-Sellers-Grocery-Gourmet-Food-Breakfast-Foods/zgbs/grocery/16310251/ref=zg_bs_nav_grocery_1
"LUNA BAR - Gluten Free Snack Bars - Nutz Over Chocolate Flavor - 9g of protein - Non-GMO - Plant-Based Wholesome Snacking - On the Go Snacks (1.69 Ounce Snack Bars, 15 Count)",$18.50 ,#69,https://www.amazon.com/Best-Sellers-Grocery-Gourmet-Food-Breakfast-Foods/zgbs/grocery/16310251/ref=zg_bs_nav_grocery_1
"ChocZero's Keto Cookie Butter Spread - No Sugar Added, Low Carb, Keto Friendly, Nut Butter Alternative, Perfect Dessert Hummus, Gluten Free, Naturally Sweetened with Monk Fruit (1 jar, 12 oz)",$9.68 ,#99,https://www.amazon.com/Best-Sellers-Grocery-Gourmet-Food-Breakfast-Foods/zgbs/grocery/16310251/ref=zg_bs_nav_grocery_1
"Bob's Red Mill Cut Oats, steel 24 Ounce",$2.54 ,#82,https://www.amazon.com/Best-Sellers-Grocery-Gourmet-Food-Breakfast-Foods/zgbs/grocery/16310251/ref=zg_bs_nav_grocery_1
"Nature Valley Chewy Granola Bars, Protein Variety Pack, Gluten Free, 21.3 oz, 15 ct",$8.76 ,#61,https://www.amazon.com/Best-Sellers-Grocery-Gourmet-Food-Breakfast-Foods/zgbs/grocery/16310251/ref=zg_bs_nav_grocery_1
"Amazon Brand - Happy Belly Old Fashioned Oats, 18 Ounce",$2.35 ,#77,https://www.amazon.com/Best-Sellers-Grocery-Gourmet-Food-Breakfast-Foods/zgbs/grocery/16310251/ref=zg_bs_nav_grocery_1
"Bob's Red Mill Old Country Style Muesli Cereal, 1.12 lb",$5.25 ,#85,https://www.amazon.com/Best-Sellers-Grocery-Gourmet-Food-Breakfast-Foods/zgbs/grocery/16310251/ref=zg_bs_nav_grocery_1
"Multi Grain Cheerios Heart Healthy Cereal, Gluten Free Multigrain Cereal with Whole Grain Oats, 12 oz",$3.98 ,#90,https://www.amazon.com/Best-Sellers-Grocery-Gourmet-Food-Breakfast-Foods/zgbs/grocery/16310251/ref=zg_bs_nav_grocery_1
"Nature Valley Granola Bars, Sweet and Salty Variety Pack, 24 ct",$9.22 ,#86,https://www.amazon.com/Best-Sellers-Grocery-Gourmet-Food-Breakfast-Foods/zgbs/grocery/16310251/ref=zg_bs_nav_grocery_1
"Natures Valley Granola Bars, Crunchy Oats N Honey",$19.85 ,#97,https://www.amazon.com/Best-Sellers-Grocery-Gourmet-Food-Breakfast-Foods/zgbs/grocery/16310251/ref=zg_bs_nav_grocery_1
Sunbelt Bakery Oats and Honey Chewy Granola Bars Value Pack (15 Count),$3.24 ,#98,https://www.amazon.com/Best-Sellers-Grocery-Gourmet-Food-Breakfast-Foods/zgbs/grocery/16310251/ref=zg_bs_nav_grocery_1
"Golden Grahams, Breakfast Cereal, Graham Cracker Taste, Whole Grain, 18.9 oz",$3.98 ,#96,https://www.amazon.com/Best-Sellers-Grocery-Gourmet-Food-Breakfast-Foods/zgbs/grocery/16310251/ref=zg_bs_nav_grocery_1
Post Honey Bunches of Oats Crunchy Honey Roasted Cereal 18 Ounce (Pack of 1) Box,$2.55 ,#67,https://www.amazon.com/Best-Sellers-Grocery-Gourmet-Food-Breakfast-Foods/zgbs/grocery/16310251/ref=zg_bs_nav_grocery_1
"Nature’s Bakery Gluten Free Fig Bars, Blueberry, Real Fruit, Vegan, Non-GMO, Snack Bar, 1 Box With 6 Twin Packs (6 Twin Packs)",$9.45 ,#89,https://www.amazon.com/Best-Sellers-Grocery-Gourmet-Food-Breakfast-Foods/zgbs/grocery/16310251/ref=zg_bs_nav_grocery_1
"GoGo squeeZ Organic Fruit on the Go, Apple Apple, 3.2 oz. (12 Pouches) - Tasty Kids Applesauce Snacks Made from Organic Apples - Gluten Free Snacks For Kids - Nut & Dairy Free - Vegan Snacks",$11.49 ,#75,https://www.amazon.com/Best-Sellers-Grocery-Gourmet-Food-Breakfast-Foods/zgbs/grocery/16310251/ref=zg_bs_nav_grocery_1
"Gluten Free Vegan Fruit & Nut Bar, 12 Count (Pack of 1)",$9.99 ,#76,https://www.amazon.com/Best-Sellers-Grocery-Gourmet-Food-Breakfast-Foods/zgbs/grocery/16310251/ref=zg_bs_nav_grocery_1
"Munk Pack Keto Granola Bar | Gluten, Grain & Soy Free | Breakfast Snacks for Kids & Adults | Chewy and Delicious | Plant Based Snacks | No Sugar Added | On the Go | Variety | 6 Pack",$14.99 ,#71,https://www.amazon.com/Best-Sellers-Grocery-Gourmet-Food-Breakfast-Foods/zgbs/grocery/16310251/ref=zg_bs_nav_grocery_1
"Cap'n Crunch Cereal, Original & Crunch Berries Variety Pack, Large Size Boxes, (4 Pack)",$12.99 ,#80,https://www.amazon.com/Best-Sellers-Grocery-Gourmet-Food-Breakfast-Foods/zgbs/grocery/16310251/ref=zg_bs_nav_grocery_1
"Gluten Free Fruit and Nut Bars | Chocolate Chip | Cookie Dough, 12 Count (Pack of 1)",$9.99 ,#64,https://www.amazon.com/Best-Sellers-Grocery-Gourmet-Food-Breakfast-Foods/zgbs/grocery/16310251/ref=zg_bs_nav_grocery_1
"Bob's Red Mill Gluten Free Oatmeal Cup, Apple pieces and Cinnamon with Flax and Chia, 2.36 oz",$3.99 ,#65,https://www.amazon.com/Best-Sellers-Grocery-Gourmet-Food-Breakfast-Foods/zgbs/grocery/16310251/ref=zg_bs_nav_grocery_1
"Purely Elizabeth, Blueberry Hemp, Ancient Grain Granola, Vegan, Gluten-Free, non-GMO, 12oz (3 ct.)",$13.74 ,#70,https://www.amazon.com/Best-Sellers-Grocery-Gourmet-Food-Breakfast-Foods/zgbs/grocery/16310251/ref=zg_bs_nav_grocery_1
"YES Bar – Black Sesame Salt – Plant Based Protein, Decadent Snack Bar – Vegan, Paleo, Gluten Free, Dairy Free, Low Sugar, Healthy Snack, Breakfast, Low Carb, Keto Friendly (Pack of 6)",$13.48 ,#83,https://www.amazon.com/Best-Sellers-Grocery-Gourmet-Food-Breakfast-Foods/zgbs/grocery/16310251/ref=zg_bs_nav_grocery_1
"Nature Valley Granola Bars, Sweet and Salty Nut, Dark Chocolate Peanut & Almond, 1.2 oz, 6 ct (Pack of 6)",$6.27 ,#88,https://www.amazon.com/Best-Sellers-Grocery-Gourmet-Food-Breakfast-Foods/zgbs/grocery/16310251/ref=zg_bs_nav_grocery_1
"Cinnamon Keto Nut Granola | 1g Net Carb Keto Snack | Low Carb Keto Cereal | Healthy Breakfast Keto Food, 11 Ounces",$12.99 ,#68,https://www.amazon.com/Best-Sellers-Grocery-Gourmet-Food-Breakfast-Foods/zgbs/grocery/16310251/ref=zg_bs_nav_grocery_1
"FITCRUNCH Snack Size Protein Bars, Designed by Robert Irvine, World’s Only 6-Layer Baked Bar, Just 3g of Sugar & Soft Cake Core (9 Count, Chocolate Chip Cookie Dough)",$19.95 ,#91,https://www.amazon.com/Best-Sellers-Grocery-Gourmet-Food-Breakfast-Foods/zgbs/grocery/16310251/ref=zg_bs_nav_grocery_1
"NuTrail™ - Keto Nut Granola Healthy Breakfast Cereal - Low Carb Snacks & Food - 2g Net Carbs - Almonds, Pecans, Coconut and more (11 oz) (1 Count)",$10.44 ,#93,https://www.amazon.com/Best-Sellers-Grocery-Gourmet-Food-Breakfast-Foods/zgbs/grocery/16310251/ref=zg_bs_nav_grocery_1
"Bobo's Oat Bars (Almond Butter, 12 Pack of 3 oz Bars) Gluten Free Whole Grain Rolled Oat Bars - Great Tasting Vegan On-The-Go Snack, Made in the USA",$28.56 ,#84,https://www.amazon.com/Best-Sellers-Grocery-Gourmet-Food-Breakfast-Foods/zgbs/grocery/16310251/ref=zg_bs_nav_grocery_1
"Made Good Healthy Snacks Variety Pack, 40 Ct - Organic Assortment of Granola Bars, Granola Mini Snack Packs, Crispy Squares; Individually Wrapped Snacks",$29.99 ,#72,https://www.amazon.com/Best-Sellers-Grocery-Gourmet-Food-Breakfast-Foods/zgbs/grocery/16310251/ref=zg_bs_nav_grocery_1
"KIND Healthy Grains Clusters, Cinnamon Oat with Flax Seeds Granola, 10g Protein, Gluten Free, 11 Ounce (Pack of 3)",$13.59 ,#100,https://www.amazon.com/Best-Sellers-Grocery-Gourmet-Food-Breakfast-Foods/zgbs/grocery/16310251/ref=zg_bs_nav_grocery_1
"HERSHEY'S Genuine Chocolate Flavor Sugar Free Syrup, Drink Mix, 17.5 Oz. Bottle (6 Count)",$9.34 ,#74,https://www.amazon.com/Best-Sellers-Grocery-Gourmet-Food-Breakfast-Foods/zgbs/grocery/16310251/ref=zg_bs_nav_grocery_1
"ChocZero's Caramel Syrup. Sugar free, Low Carb, No preservatives. Thick and Rich. Sugar Alcohol free, Gluten Free, Dessert and Breakfast Topping. 1 Bottle(12oz)",$7.53 ,#78,https://www.amazon.com/Best-Sellers-Grocery-Gourmet-Food-Breakfast-Foods/zgbs/grocery/16310251/ref=zg_bs_nav_grocery_1
"Reese's Puffs Breakfast Cereal, Chocolate Peanut Butter with Whole Grain, 11.5 oz",$3.28 ,#66,https://www.amazon.com/Best-Sellers-Grocery-Gourmet-Food-Breakfast-Foods/zgbs/grocery/16310251/ref=zg_bs_nav_grocery_1
"Nature Valley Soft-Baked Oatmeal Squares, Cinnamon Brown Sugar, 7.44 oz, 6 ct",$3.19 ,#62,https://www.amazon.com/Best-Sellers-Grocery-Gourmet-Food-Breakfast-Foods/zgbs/grocery/16310251/ref=zg_bs_nav_grocery_1
"KIND Bar Minis, Variety Pack, Dark Chocolate Nuts, Caramel Almond Sea Salt, Peanut Butter Dark Chocolate, Gluten Free, Low Sugar, 0.7 oz, 30 Count",$21.99 ,#73,https://www.amazon.com/Best-Sellers-Grocery-Gourmet-Food-Breakfast-Foods/zgbs/grocery/16310251/ref=zg_bs_nav_grocery_1
"Pop-Tarts Toaster Pastries, Frosted Brown Sugar Cinnamon, Breakfast Foods, Fun Snacks for Kids (64 Pop-Tarts)",$15.76 ,#92,https://www.amazon.com/Best-Sellers-Grocery-Gourmet-Food-Breakfast-Foods/zgbs/grocery/16310251/ref=zg_bs_nav_grocery_1
"Protein Pancake Power Cakes, Flapack and Waffle Mix, Almond Poppyseed, 18 Ounce (Pack of 6)",$14.97 ,#94,https://www.amazon.com/Best-Sellers-Grocery-Gourmet-Food-Breakfast-Foods/zgbs/grocery/16310251/ref=zg_bs_nav_grocery_1
"Anthony's Organic Vital Wheat Gluten, 2 lb, High in Protein, Vegan, Non GMO, Keto Friendly, Low Carb",$18.49 ,#1,https://www.amazon.com/Best-Sellers-Grocery-Gourmet-Food-Meat-Substitutes/zgbs/grocery/6518859011/ref=zg_bs_nav_grocery_1
Davines OI All in One Milk | Hair Milk Spray | Powerful Hair Detangler + Heat Protection | Smoothes Frizzy Hair | 4.56 Fl Oz,$36.00 ,#2,https://www.amazon.com/Best-Sellers-Grocery-Gourmet-Food-Meat-Substitutes/zgbs/grocery/6518859011/ref=zg_bs_nav_grocery_1
"Mori-Nu Silken Tofu, Extra Firm, 12.3 Ounce (Case of 12)",$24.39 ,#4,https://www.amazon.com/Best-Sellers-Grocery-Gourmet-Food-Meat-Substitutes/zgbs/grocery/6518859011/ref=zg_bs_nav_grocery_1
"Bob's Red Mill TVP (Textured Vegetable Protein), 12-ounce (Pack of 4)",$19.16 ,#5,https://www.amazon.com/Best-Sellers-Grocery-Gourmet-Food-Meat-Substitutes/zgbs/grocery/6518859011/ref=zg_bs_nav_grocery_1
"Anthony's Organic Textured Vegetable Protein, TVP, 1.5 Pound, Gluten Free, Vegan, Made in USA, Unflavored",$11.99 ,#3,https://www.amazon.com/Best-Sellers-Grocery-Gourmet-Food-Meat-Substitutes/zgbs/grocery/6518859011/ref=zg_bs_nav_grocery_1
"Textured Vegetable Protein Chunks, 1 lb.",$16.87 ,#18,https://www.amazon.com/Best-Sellers-Grocery-Gourmet-Food-Meat-Substitutes/zgbs/grocery/6518859011/ref=zg_bs_nav_grocery_1
Vegan Burger (9 Patties) - B.B. & Ohh!,$8.99 ,#21,https://www.amazon.com/Best-Sellers-Grocery-Gourmet-Food-Meat-Substitutes/zgbs/grocery/6518859011/ref=zg_bs_nav_grocery_1
"Companion - Braised Gluten Seitan Tidbits, 10 oz. Can (Pack of 6)",$23.99 ,#22,https://www.amazon.com/Best-Sellers-Grocery-Gourmet-Food-Meat-Substitutes/zgbs/grocery/6518859011/ref=zg_bs_nav_grocery_1
"Loma Linda - Plant-Based - Vegetarian Burger - Kosher, 1.25 Pound (Pack of 12)",$95.99 ,#29,https://www.amazon.com/Best-Sellers-Grocery-Gourmet-Food-Meat-Substitutes/zgbs/grocery/6518859011/ref=zg_bs_nav_grocery_1
Loma Linda - Plant-Based - FriChik (12.5 oz.) - Kosher,$9.36 ,#31,https://www.amazon.com/Best-Sellers-Grocery-Gourmet-Food-Meat-Substitutes/zgbs/grocery/6518859011/ref=zg_bs_nav_grocery_1
