Rip Van WAFELS Dutch Caramel & Vanilla Stroopwafels - Healthy Snacks - Non GMO Snack - Keto Friendly - Office Snacks - Low Sugar (3g) - Low Calorie Snack - 12 Count (Packaging May Vary),$15.99 ,#1,https://www.amazon.com/Best-Sellers-Grocery-Gourmet-Food-Deli-Prepared-Foods/zgbs/grocery/18773724011/ref=zg_bs_nav_grocery_1
"Chicken of the Sea Wild Catch, Ahi Yellowfin Tuna, 4.5 Oz Cups, Pack of 8",$21.92 ,#24,https://www.amazon.com/Best-Sellers-Grocery-Gourmet-Food-Deli-Prepared-Foods/zgbs/grocery/18773724011/ref=zg_bs_nav_grocery_1
"Chicken of the Sea, Chunk Light Tuna in Water, 5 oz. Can (Pack of 10)",$8.92 ,#2,https://www.amazon.com/Best-Sellers-Grocery-Gourmet-Food-Deli-Prepared-Foods/zgbs/grocery/18773724011/ref=zg_bs_nav_grocery_1
"Pepperwood Organic Stone-Ground Ethiopian Sesame Tahini Paste, Hulled, Unsalted, Non-GMO, Gluten-Free, Kosher, Vegan, USDA Organic, Peanut-Free, 6.6lb Bucket",$5.99 ,#10,https://www.amazon.com/Best-Sellers-Grocery-Gourmet-Food-Deli-Prepared-Foods/zgbs/grocery/18773724011/ref=zg_bs_nav_grocery_1
"HMR Customer Favorites Entree Pack 1 ea Penne Pasta w/Meatballs, Rotini Chicken Alfredo, Beef Stroganoff, Lasagna w/Meat Sauce, Chicken Pasta Parmesan, Turkey Chili, 7–8 oz. Servings, 6 Ready to Eat Meals",$25.50 ,#17,https://www.amazon.com/Best-Sellers-Grocery-Gourmet-Food-Deli-Prepared-Foods/zgbs/grocery/18773724011/ref=zg_bs_nav_grocery_1
Rip Van Wafels Cookies & Cream Stroopwafels - Healthy Snacks - Non GMO Snack - Keto Friendly - Office Snacks - Low Sugar (3g) - Low Calorie Snack - 12 Pack,$17.99 ,#18,https://www.amazon.com/Best-Sellers-Grocery-Gourmet-Food-Deli-Prepared-Foods/zgbs/grocery/18773724011/ref=zg_bs_nav_grocery_1
The Miracle Meal Pre-filled Communion Cups and Wafer Set - Box of 100 - with 100% Trusted Concord Grape Juice & Wafer - Made in the USA - Premium Quality Guaranteed - Pack of 100,$28.99 ,#9,https://www.amazon.com/Best-Sellers-Grocery-Gourmet-Food-Deli-Prepared-Foods/zgbs/grocery/18773724011/ref=zg_bs_nav_grocery_1
72 Pieces 10 Kinds Artificial Palm Leaves Golden Tropical Leaves with Stems Jungle Leaves Decorations for Hawaiian Luau Party Beach Baby Shower Wedding Birthday Decorations,$13.99 ,#11,https://www.amazon.com/Best-Sellers-Grocery-Gourmet-Food-Deli-Prepared-Foods/zgbs/grocery/18773724011/ref=zg_bs_nav_grocery_1
Celebration Cup - Prefilled Communion Cups & Wafer Set - (Pack of 100),$45.99 ,#4,https://www.amazon.com/Best-Sellers-Grocery-Gourmet-Food-Deli-Prepared-Foods/zgbs/grocery/18773724011/ref=zg_bs_nav_grocery_1
Lizano Salsa 700 mL - 2 bottles,$24.99 ,#13,https://www.amazon.com/Best-Sellers-Grocery-Gourmet-Food-Deli-Prepared-Foods/zgbs/grocery/18773724011/ref=zg_bs_nav_grocery_1
"Baron's USDA Organic Tahini Pure Sesame Paste | Rich & Creamy for Hummus, Baba Ghanoush & Dressings | Kosher, Vegan, Unsalted Ground Seeds | Gluten- & Peanut-Free, Keto-Friendly | 2 Jars of 16 Oz.",$14.99 ,#15,https://www.amazon.com/Best-Sellers-Grocery-Gourmet-Food-Deli-Prepared-Foods/zgbs/grocery/18773724011/ref=zg_bs_nav_grocery_1
Giorgio Mushroom Pieces and Stems - 12/4 oz. A1,$13.99 ,#16,https://www.amazon.com/Best-Sellers-Grocery-Gourmet-Food-Deli-Prepared-Foods/zgbs/grocery/18773724011/ref=zg_bs_nav_grocery_1
"Tostitos Queso Variety Pack, 4 Count, 15.5 Ounce (Pack of 4)",$17.99 ,#6,https://www.amazon.com/Best-Sellers-Grocery-Gourmet-Food-Deli-Prepared-Foods/zgbs/grocery/18773724011/ref=zg_bs_nav_grocery_1
"Tostitos Medium Chunky Salsa, 4 Count, 15.5 oz Jars",$13.74 ,#5,https://www.amazon.com/Best-Sellers-Grocery-Gourmet-Food-Deli-Prepared-Foods/zgbs/grocery/18773724011/ref=zg_bs_nav_grocery_1
,,,https://www.amazon.com/Best-Sellers-Grocery-Gourmet-Food-Deli-Prepared-Foods/zgbs/grocery/18773724011/ref=zg_bs_nav_grocery_1
Rip Van Wafels Snickerdoodle Stroopwafels - Healthy Snacks - Non GMO Snack - Keto Friendly - Office Snacks - Low Sugar (3g) - Low Calorie Snack - 12 Pack,$17.99 ,#12,https://www.amazon.com/Best-Sellers-Grocery-Gourmet-Food-Deli-Prepared-Foods/zgbs/grocery/18773724011/ref=zg_bs_nav_grocery_1
"Foustman's Salami (5 Alarm Habanero) Artisanal, Nitrate-Free, Naturally Cured",$14.95 ,#20,https://www.amazon.com/Best-Sellers-Grocery-Gourmet-Food-Deli-Prepared-Foods/zgbs/grocery/18773724011/ref=zg_bs_nav_grocery_1
Sanniti Spanish Non Pareil Capers in Vinegar and Salt Brine - 33.5 oz,$17.99 ,#22,https://www.amazon.com/Best-Sellers-Grocery-Gourmet-Food-Deli-Prepared-Foods/zgbs/grocery/18773724011/ref=zg_bs_nav_grocery_1
"All Natural Tahini | 100% Pure Stone Ground Sesame | Best for Hummus, Dressings, Sauce | Single-Sourced Ethiopian Origin | Vegan | Paleo | Kosher | 16oz Jar - PACK OF 10",$6.86 ,#19,https://www.amazon.com/Best-Sellers-Grocery-Gourmet-Food-Deli-Prepared-Foods/zgbs/grocery/18773724011/ref=zg_bs_nav_grocery_1
The Miracle Meal Pre-filled Communion Cups and Wafer Set - Box of 100 - with 100% Trusted Concord Grape Juice & Wafer - Made in the USA - Premium Quality Guaranteed,,#21,https://www.amazon.com/Best-Sellers-Grocery-Gourmet-Food-Deli-Prepared-Foods/zgbs/grocery/18773724011/ref=zg_bs_nav_grocery_1
"Mighty Sesame, Organic, Fine Sesame Tahini, 10.9oz, Squeezable Bottle, Gluten Free, Ready to use!",$7.99 ,#8,https://www.amazon.com/Best-Sellers-Grocery-Gourmet-Food-Deli-Prepared-Foods/zgbs/grocery/18773724011/ref=zg_bs_nav_grocery_1
"Iberia Corned Beef, 12 oz, Premium Quality Corned Beef With Natural Juices, Halal",$4.49 ,#23,https://www.amazon.com/Best-Sellers-Grocery-Gourmet-Food-Deli-Prepared-Foods/zgbs/grocery/18773724011/ref=zg_bs_nav_grocery_1
"Mighty Sesame Co. Organic Tahini, Squeezable Creamy & Ready Tahini Paste, 10.9oz (2 Pack) Just One Ingredient, Gluten Free, Vegan, Non GMO, Keto Friendly, Kosher",$13.74 ,#7,https://www.amazon.com/Best-Sellers-Grocery-Gourmet-Food-Deli-Prepared-Foods/zgbs/grocery/18773724011/ref=zg_bs_nav_grocery_1
"Campbell's Condensed Cream of Chicken Soup, 10.5 Ounce Can (Pack of 48)",$11.25 ,#28,https://www.amazon.com/Best-Sellers-Grocery-Gourmet-Food-Deli-Prepared-Foods/zgbs/grocery/18773724011/ref=zg_bs_nav_grocery_1
Nutrisystem® Members’ Favorites 7-Day Weight Loss Kit with 28 Delicious Meals & Snacks,$72.99 ,#31,https://www.amazon.com/Best-Sellers-Grocery-Gourmet-Food-Deli-Prepared-Foods/zgbs/grocery/18773724011/ref=zg_bs_nav_grocery_1
"Yi Bin Sui Mi Ya Cai - YiBin SuiMiYaCai - Dried Vegetable, 8.1oz (230g)",$6.99 ,#35,https://www.amazon.com/Best-Sellers-Grocery-Gourmet-Food-Deli-Prepared-Foods/zgbs/grocery/18773724011/ref=zg_bs_nav_grocery_1
"Earth's Best Organic Sesame Street Toddler Snacks, Letter of the Day Cookies, Oatmeal Cinnamon, 5.3 Oz Box (Pack of 6)",$20.94 ,#41,https://www.amazon.com/Best-Sellers-Grocery-Gourmet-Food-Deli-Prepared-Foods/zgbs/grocery/18773724011/ref=zg_bs_nav_grocery_1
Lebanon Valley Tahineh Extra 32 Oz.,$12.69 ,#47,https://www.amazon.com/Best-Sellers-Grocery-Gourmet-Food-Deli-Prepared-Foods/zgbs/grocery/18773724011/ref=zg_bs_nav_grocery_1
"Soom Foods Single-Source Pure Ground Premium Sesame Tahini Paste 16oz (2 Pack) | Silky Smooth Texture in Hummus, Dips, Dressings | Vegan, Nut-Free, Gluten-Free, Dairy-Free, Paleo, Keto",$21.99 ,#49,https://www.amazon.com/Best-Sellers-Grocery-Gourmet-Food-Deli-Prepared-Foods/zgbs/grocery/18773724011/ref=zg_bs_nav_grocery_1
The Wild Mushroom Co. Dried Gourmet Mix European Mushrooms 12 Ounces (340g) - 3 Pack,$22.99 ,#37,https://www.amazon.com/Best-Sellers-Grocery-Gourmet-Food-Deli-Prepared-Foods/zgbs/grocery/18773724011/ref=zg_bs_nav_grocery_1
"KETO BARS : The Original High Fat, Low Carb, Ketogenic Bar. Gluten Free, Vegan, Homemade with simple ingredients. [Chocolate Peanut Butter, 10 Pack]",$29.50 ,#32,https://www.amazon.com/Best-Sellers-Grocery-Gourmet-Food-Deli-Prepared-Foods/zgbs/grocery/18773724011/ref=zg_bs_nav_grocery_1
"King Oscar Kipper Snacks, Smoked Herring Fillets, 3.54 Oz, Pack Of 12",$25.92 ,#36,https://www.amazon.com/Best-Sellers-Grocery-Gourmet-Food-Deli-Prepared-Foods/zgbs/grocery/18773724011/ref=zg_bs_nav_grocery_1
"BUSH'S BEST Canned Maple Cured Bacon Baked Beans (Pack of 12) Source of Plant Based Protein and Fiber, Low Fat, Gluten Free, 16 oz",$26.40 ,#33,https://www.amazon.com/Best-Sellers-Grocery-Gourmet-Food-Deli-Prepared-Foods/zgbs/grocery/18773724011/ref=zg_bs_nav_grocery_1
"Kirkland Signature Turkey Strips 13.5 Oz (0.84 Lbs), 13.5 Oz",$19.47 ,#38,https://www.amazon.com/Best-Sellers-Grocery-Gourmet-Food-Deli-Prepared-Foods/zgbs/grocery/18773724011/ref=zg_bs_nav_grocery_1
"HMR Penne Pasta with Meatballs in Sauce Entree, 8 oz. Servings, 6 Ready to Eat Meals",$25.50 ,#44,https://www.amazon.com/Best-Sellers-Grocery-Gourmet-Food-Deli-Prepared-Foods/zgbs/grocery/18773724011/ref=zg_bs_nav_grocery_1
"Chef's Cut Real Smoked Chicken Breast Honey Barbecue Jerky, 14 Ounce",$24.49 ,#48,https://www.amazon.com/Best-Sellers-Grocery-Gourmet-Food-Deli-Prepared-Foods/zgbs/grocery/18773724011/ref=zg_bs_nav_grocery_1
"That Pickle Guy New Orleans Style Classic Olive Muffalata, Gluten, Sugar-Free, All Natural, Vegan, Best with any Deli, Rich in Flavor; USA Made, 24-oz",$16.89 ,#39,https://www.amazon.com/Best-Sellers-Grocery-Gourmet-Food-Deli-Prepared-Foods/zgbs/grocery/18773724011/ref=zg_bs_nav_grocery_1
"👍 💖 Lyan Mekong River Banh Trang Vietnamese Brown Rice Paper Wrappers, Spring Roll Wrappers, Rice Wrappers for Vegan Spring Rolls- (300g Round 22cm)",$10.68 ,#26,https://www.amazon.com/Best-Sellers-Grocery-Gourmet-Food-Deli-Prepared-Foods/zgbs/grocery/18773724011/ref=zg_bs_nav_grocery_1
"Maille Original Cornichons Gherkins, 13.5 oz (Pack of 2)",$17.99 ,#40,https://www.amazon.com/Best-Sellers-Grocery-Gourmet-Food-Deli-Prepared-Foods/zgbs/grocery/18773724011/ref=zg_bs_nav_grocery_1
"Lizano Salsa Sauce, 23.7 Fl Oz",$8.95 ,#43,https://www.amazon.com/Best-Sellers-Grocery-Gourmet-Food-Deli-Prepared-Foods/zgbs/grocery/18773724011/ref=zg_bs_nav_grocery_1
"Creminelli Casalingo Salami - Humanely-Raised U.S. Pork, Keto & Paleo Friendly, High Protien - Sugar Free, Gluten Free (Casalingo, 5.5 Ounce (Pack of 1))…",$7.44 ,#27,https://www.amazon.com/Best-Sellers-Grocery-Gourmet-Food-Deli-Prepared-Foods/zgbs/grocery/18773724011/ref=zg_bs_nav_grocery_1
"Mina Capers Non Pareil, The Perfect Mediterranean Seasoning or Garnish, 33.5 oz",$17.95 ,#46,https://www.amazon.com/Best-Sellers-Grocery-Gourmet-Food-Deli-Prepared-Foods/zgbs/grocery/18773724011/ref=zg_bs_nav_grocery_1
"CREMINELLI Black Pepper Salami Minis Snacks, Humanely-Raised U.S. Pork, Keto & Paleo Friendly, 8g of Protein - Sugar Free, Gluten Free, No Added Nitrates or Nitrites (Black Pepper, 1.1oz 12 Pack)",$6.98 ,#29,https://www.amazon.com/Best-Sellers-Grocery-Gourmet-Food-Deli-Prepared-Foods/zgbs/grocery/18773724011/ref=zg_bs_nav_grocery_1
Rip Van Wafels Chocolate Brownie Stroopwafels - Healthy Snacks - Non GMO Snack - Keto Friendly - Office Snacks - Low Sugar (3g) - Low Calorie Snack - 1.16 Ounce (Pack of 12),$17.99 ,#42,https://www.amazon.com/Best-Sellers-Grocery-Gourmet-Food-Deli-Prepared-Foods/zgbs/grocery/18773724011/ref=zg_bs_nav_grocery_1
"Roland Foods Dried Mixed Wild Mushrooms Specialty Imported Food 1Pound , 16 Ounce",$32.46 ,#45,https://www.amazon.com/Best-Sellers-Grocery-Gourmet-Food-Deli-Prepared-Foods/zgbs/grocery/18773724011/ref=zg_bs_nav_grocery_1
"Reese Petite Artichoke Hearts, 7 Ounces (Pack of 12)",$14.49 ,#25,https://www.amazon.com/Best-Sellers-Grocery-Gourmet-Food-Deli-Prepared-Foods/zgbs/grocery/18773724011/ref=zg_bs_nav_grocery_1
"V8 Blends Healthy Greens Juice, 46 FL OZ Bottle (Pack of 6)",$23.37 ,#30,https://www.amazon.com/Best-Sellers-Grocery-Gourmet-Food-Deli-Prepared-Foods/zgbs/grocery/18773724011/ref=zg_bs_nav_grocery_1
"Organic Sliced Crimini Mushrooms, 4 Ounce Cans (12 Count), 1 Pack",$27.60 ,#34,https://www.amazon.com/Best-Sellers-Grocery-Gourmet-Food-Deli-Prepared-Foods/zgbs/grocery/18773724011/ref=zg_bs_nav_grocery_1
"Mrs. Wages Pickled Okra and Vegetables Quick Process Mix (VALUE PACK of 12), 3.36 Ounce (Pack of 12)",$15.60 ,#50,https://www.amazon.com/Best-Sellers-Grocery-Gourmet-Food-Deli-Prepared-Foods/zgbs/grocery/18773724011/ref=zg_bs_nav_grocery_1
"Vlasic Deli Style Hot Banana Pepper, Keto Friendly, 6 - 12 FL OZ Jars",$10.32 ,#55,https://www.amazon.com/Best-Sellers-Grocery-Gourmet-Food-Deli-Prepared-Foods/zgbs/grocery/18773724011/ref=zg_bs_nav_grocery_1
"Keto Burgundy Wine Pasta Sauce by Yo Mama's Foods - Pack of (1) - No Sugar Added, Low Carb, Low Sodium, Gluten Free, Paleo Friendly, and Made with Whole, Non-GMO Tomatoes",$9.36 ,#51,https://www.amazon.com/Best-Sellers-Grocery-Gourmet-Food-Deli-Prepared-Foods/zgbs/grocery/18773724011/ref=zg_bs_nav_grocery_1
"PEPPADEW Sweet Piquant Peppers, 14 Ounce",$9.80 ,#59,https://www.amazon.com/Best-Sellers-Grocery-Gourmet-Food-Deli-Prepared-Foods/zgbs/grocery/18773724011/ref=zg_bs_nav_grocery_1
"Streit's Matzo Ball & Soup Mix, Kosher For Passover, Easy to Prepare, Delicious & Authentic Matzo Balls, 4.5 Oz (Single)",$3.27 ,#65,https://www.amazon.com/Best-Sellers-Grocery-Gourmet-Food-Deli-Prepared-Foods/zgbs/grocery/18773724011/ref=zg_bs_nav_grocery_1
"Ricos Cheddar Cheese Sauce, 140oz Bags, 4 Pack",$89.99 ,#60,https://www.amazon.com/Best-Sellers-Grocery-Gourmet-Food-Deli-Prepared-Foods/zgbs/grocery/18773724011/ref=zg_bs_nav_grocery_1
"HMR Turkey Chili with Beans Entree, 8 oz. servings, 24 Ready to Eat Meals",$25.50 ,#57,https://www.amazon.com/Best-Sellers-Grocery-Gourmet-Food-Deli-Prepared-Foods/zgbs/grocery/18773724011/ref=zg_bs_nav_grocery_1
Boar's Head Charcuterie Salami Sampler Includes 7 Types Of Salami,$69.99 ,#56,https://www.amazon.com/Best-Sellers-Grocery-Gourmet-Food-Deli-Prepared-Foods/zgbs/grocery/18773724011/ref=zg_bs_nav_grocery_1
"Toufayan Bakery, Plain Original Gluten Free Wraps for Sandwiches, Tortillas, Burritos and Snacks, Gluten Free, Naturally Vegan and Kosher (Original, 3 Pack)",$25.74 ,#53,https://www.amazon.com/Best-Sellers-Grocery-Gourmet-Food-Deli-Prepared-Foods/zgbs/grocery/18773724011/ref=zg_bs_nav_grocery_1
"BRAMI Roman Lupini Bean Dip, Spread & Hummus | 0g Sugar, 0g Net Carbs | Keto, Vegan, Vegetarian, Mediterranean, Non-Perishable, Shelf-Stable, Low Carb, Low Calorie | 10oz (Calabrian Pepper, 4 Count)",$29.99 ,#54,https://www.amazon.com/Best-Sellers-Grocery-Gourmet-Food-Deli-Prepared-Foods/zgbs/grocery/18773724011/ref=zg_bs_nav_grocery_1
"Wang Bulgogi Hot Pot Soup Base, 7.05 Ounce, Pack of 5",$5.99 ,#52,https://www.amazon.com/Best-Sellers-Grocery-Gourmet-Food-Deli-Prepared-Foods/zgbs/grocery/18773724011/ref=zg_bs_nav_grocery_1
"Orlando California Grapes Leaves, 16 Ounce",$17.78 ,#61,https://www.amazon.com/Best-Sellers-Grocery-Gourmet-Food-Deli-Prepared-Foods/zgbs/grocery/18773724011/ref=zg_bs_nav_grocery_1
"DeLallo Sweet & Tangy Pepper Drops, Gourmet Antipasto Accent, 4.3oz Jar, 1-Pack",$6.66 ,#63,https://www.amazon.com/Best-Sellers-Grocery-Gourmet-Food-Deli-Prepared-Foods/zgbs/grocery/18773724011/ref=zg_bs_nav_grocery_1
Iberico de Bellota Ham Sliced by Hand (2 oz). GLUTEN FREE by Fermin,$25.95 ,#64,https://www.amazon.com/Best-Sellers-Grocery-Gourmet-Food-Deli-Prepared-Foods/zgbs/grocery/18773724011/ref=zg_bs_nav_grocery_1
Trader Joe’s Mushroom & Company Multipurpose UMAMI Seasoning Blend NET WT. (2 Packs) 2.1 OZ,$12.00 ,#58,https://www.amazon.com/Best-Sellers-Grocery-Gourmet-Food-Deli-Prepared-Foods/zgbs/grocery/18773724011/ref=zg_bs_nav_grocery_1
"Artisanal Tahini Paste, Pure Ground Sesame Paste Tahini for Hummus, Vegan Dressings and Sauces, Plant-Based, Gluten-Free, Non-GMO, Kosher Condiment, 13.4 oz (380 g), Pack of 1 - SoCo",$11.55 ,#62,https://www.amazon.com/Best-Sellers-Grocery-Gourmet-Food-Deli-Prepared-Foods/zgbs/grocery/18773724011/ref=zg_bs_nav_grocery_1
Mama Kim's Kimchi - Premium Spicy Napa Cabbage Kimchi 32oz Pouch FRESH,$26.99 ,#76,https://www.amazon.com/Best-Sellers-Grocery-Gourmet-Food-Deli-Prepared-Foods/zgbs/grocery/18773724011/ref=zg_bs_nav_grocery_1
"instecho Festival Organic Sliced Mushrooms, 4 Ounce (Pack of 12), Pink",$21.29 ,#88,https://www.amazon.com/Best-Sellers-Grocery-Gourmet-Food-Deli-Prepared-Foods/zgbs/grocery/18773724011/ref=zg_bs_nav_grocery_1
"EXCELSIOR Corned Beef in Natural Juices, 12 Ounce",$5.19 ,#66,https://www.amazon.com/Best-Sellers-Grocery-Gourmet-Food-Deli-Prepared-Foods/zgbs/grocery/18773724011/ref=zg_bs_nav_grocery_1
"Soom Foods Single-Source Pure Ground Organic Sesame Tahini Paste 16oz (2 Pack) | Silky Smooth Texture in Hummus, Dips, Salad Dressings | Vegan, Nut-Free, Gluten-Free, Dairy-Free, Keto, Paleo, Plant Based, Kosher, Organic",$25.00 ,#69,https://www.amazon.com/Best-Sellers-Grocery-Gourmet-Food-Deli-Prepared-Foods/zgbs/grocery/18773724011/ref=zg_bs_nav_grocery_1
"Litehouse Freeze Dried Guacamole Herb Blend, 0.85 Ounce",$6.97 ,#72,https://www.amazon.com/Best-Sellers-Grocery-Gourmet-Food-Deli-Prepared-Foods/zgbs/grocery/18773724011/ref=zg_bs_nav_grocery_1
"Kirkland Signature Artichoke Hearts, 66 Ounce",$24.87 ,#86,https://www.amazon.com/Best-Sellers-Grocery-Gourmet-Food-Deli-Prepared-Foods/zgbs/grocery/18773724011/ref=zg_bs_nav_grocery_1
Fody Foods Vegan Pasta Sauce | Arrabbiata Sauce | Low FODMAP Certified | Gut Friendly No Onion No Garlic | IBS Friendly Kitchen Staple | Gluten Free Lactose Free Non GMO,$7.65 ,#96,https://www.amazon.com/Best-Sellers-Grocery-Gourmet-Food-Deli-Prepared-Foods/zgbs/grocery/18773724011/ref=zg_bs_nav_grocery_1
Jake & Amos - Pickled Green Tomatoes / 2 - 16 Oz. Jars,$24.95 ,#95,https://www.amazon.com/Best-Sellers-Grocery-Gourmet-Food-Deli-Prepared-Foods/zgbs/grocery/18773724011/ref=zg_bs_nav_grocery_1
"NOW Foods, Organic Quinoa Macaroni, Gluten-Free, Corn-Free, Non-GMO Elbow Pasta, 8-Ounce",$4.99 ,#68,https://www.amazon.com/Best-Sellers-Grocery-Gourmet-Food-Deli-Prepared-Foods/zgbs/grocery/18773724011/ref=zg_bs_nav_grocery_1
"Fiorucci Charcuterie Abruzzese, Family Size, 1 Pound",$14.88 ,#75,https://www.amazon.com/Best-Sellers-Grocery-Gourmet-Food-Deli-Prepared-Foods/zgbs/grocery/18773724011/ref=zg_bs_nav_grocery_1
"Roland Foods Calabrian Chili Peppers in Vinegar, Specialty Imported Food, 17.5-Ounce Package",$12.02 ,#91,https://www.amazon.com/Best-Sellers-Grocery-Gourmet-Food-Deli-Prepared-Foods/zgbs/grocery/18773724011/ref=zg_bs_nav_grocery_1
"VIENNA SPORT PEPPERS, 12 OZ, FOR CHICAGO DOGS",$11.49 ,#67,https://www.amazon.com/Best-Sellers-Grocery-Gourmet-Food-Deli-Prepared-Foods/zgbs/grocery/18773724011/ref=zg_bs_nav_grocery_1
"Wellsley Farms Marinated Mushrooms, 30.4 oz. (pack of 2)",$24.71 ,#80,https://www.amazon.com/Best-Sellers-Grocery-Gourmet-Food-Deli-Prepared-Foods/zgbs/grocery/18773724011/ref=zg_bs_nav_grocery_1
"Hungry Jack Mashed Potatoes, Country Butter Flavor, 5 Oz Box (Pack of 10), Made from 100% Idaho Potatoes, Gluten Free, No Artificial Colors or Flavors",$18.15 ,#81,https://www.amazon.com/Best-Sellers-Grocery-Gourmet-Food-Deli-Prepared-Foods/zgbs/grocery/18773724011/ref=zg_bs_nav_grocery_1
"Cucina Antica - Garlic Marinara Pasta Sauce - 24oz (Pack Of 3) - Non Gmo, Whole 30 Approved, Gluten Free",$21.94 ,#89,https://www.amazon.com/Best-Sellers-Grocery-Gourmet-Food-Deli-Prepared-Foods/zgbs/grocery/18773724011/ref=zg_bs_nav_grocery_1
"Elite Gourmet EQD-118# Non-Stick Electric, Mexican Taco Tuesday Quesadilla Maker, Easy-Slice 6-Wedge, Grilled Cheese, 11 Inch, Red",$43.99 ,#90,https://www.amazon.com/Best-Sellers-Grocery-Gourmet-Food-Deli-Prepared-Foods/zgbs/grocery/18773724011/ref=zg_bs_nav_grocery_1
"Yehuda Original Gefilte Fish 24oz (2 Pack) Premium Quality, No MSG, Original Home Style Recipe, No Egg Yolk, Kosher For Passover, Product of Israel",$17.99 ,#78,https://www.amazon.com/Best-Sellers-Grocery-Gourmet-Food-Deli-Prepared-Foods/zgbs/grocery/18773724011/ref=zg_bs_nav_grocery_1
"Certified Organic Tahini | 100% Pure Stone Ground Sesame | Best for Hummus, Dressings, Sauce | Single-Sourced Ethiopian Origin | Vegan | Paleo | Kosher | 16oz Jar - PACK OF 2",$14.15 ,#99,https://www.amazon.com/Best-Sellers-Grocery-Gourmet-Food-Deli-Prepared-Foods/zgbs/grocery/18773724011/ref=zg_bs_nav_grocery_1
Loma Linda - Plant-Based - Big Franks (20 oz.) (Pack of 3) - Kosher,$28.79 ,#87,https://www.amazon.com/Best-Sellers-Grocery-Gourmet-Food-Deli-Prepared-Foods/zgbs/grocery/18773724011/ref=zg_bs_nav_grocery_1
"Native Forest Artichoke Hearts Marinated, 6 Ounce Jar (Pack of 6)",$13.56 ,#92,https://www.amazon.com/Best-Sellers-Grocery-Gourmet-Food-Deli-Prepared-Foods/zgbs/grocery/18773724011/ref=zg_bs_nav_grocery_1
Kizami Shoga (Pickled Ginger) - 12oz (12oz (Pack of 2)),$17.97 ,#94,https://www.amazon.com/Best-Sellers-Grocery-Gourmet-Food-Deli-Prepared-Foods/zgbs/grocery/18773724011/ref=zg_bs_nav_grocery_1
"Texas Pepper Works, Candy Krisp Jalapenos, 12 oz",$10.33 ,#83,https://www.amazon.com/Best-Sellers-Grocery-Gourmet-Food-Deli-Prepared-Foods/zgbs/grocery/18773724011/ref=zg_bs_nav_grocery_1
"Cento Sun Dried Tomatoes, 10 Ounce",$8.51 ,#82,https://www.amazon.com/Best-Sellers-Grocery-Gourmet-Food-Deli-Prepared-Foods/zgbs/grocery/18773724011/ref=zg_bs_nav_grocery_1
"Matiz España Wild Cockles from Galicia, Spain in Natural Sea Salt Brine (4 oz.) Spanish Berberechos, Small Clams, Hand Packed, Size 45/55 (Pack of 1)",$9.59 ,#97,https://www.amazon.com/Best-Sellers-Grocery-Gourmet-Food-Deli-Prepared-Foods/zgbs/grocery/18773724011/ref=zg_bs_nav_grocery_1
"Pace Nacho Jalapeno Queso Dip, Great for Nachos, 15 Ounce Jar",$3.28 ,#73,https://www.amazon.com/Best-Sellers-Grocery-Gourmet-Food-Deli-Prepared-Foods/zgbs/grocery/18773724011/ref=zg_bs_nav_grocery_1
"Giorgio whole sliced Mushrooms, 4 0z. Cans,12 Count",$23.95 ,#85,https://www.amazon.com/Best-Sellers-Grocery-Gourmet-Food-Deli-Prepared-Foods/zgbs/grocery/18773724011/ref=zg_bs_nav_grocery_1
"Half Gallon (3.5 lbs.) Spicy Napa Cabbage Kimchi [Vegan, Gluten Free, Non-GMO, Probiotic] by Choi's Kimchi Co. Made in USA.",$23.99 ,#74,https://www.amazon.com/Best-Sellers-Grocery-Gourmet-Food-Deli-Prepared-Foods/zgbs/grocery/18773724011/ref=zg_bs_nav_grocery_1
"HMR Crustless Chicken Pot Pie Entrée, 8 oz. servings, 6 Ready to Eat Meals",$25.50 ,#77,https://www.amazon.com/Best-Sellers-Grocery-Gourmet-Food-Deli-Prepared-Foods/zgbs/grocery/18773724011/ref=zg_bs_nav_grocery_1
Fody Foods Vegan Medium Salsa | Chunky Tomato Jalapeno Salsa | Low FODMAP Certified | Gut Friendly IBS Friendly Kitchen Staple | Gluten Free Lactose Free Non GMO,$3.96 ,#84,https://www.amazon.com/Best-Sellers-Grocery-Gourmet-Food-Deli-Prepared-Foods/zgbs/grocery/18773724011/ref=zg_bs_nav_grocery_1
"Earth's Best Organic Sesame Street Toddler Snacks, Letter of the Day Cookies, Vanilla, 5.3 Oz Box (Pack of 6)",$22.14 ,#79,https://www.amazon.com/Best-Sellers-Grocery-Gourmet-Food-Deli-Prepared-Foods/zgbs/grocery/18773724011/ref=zg_bs_nav_grocery_1
"Kosher For Passover Gluten Free Food, Roast Chicken with Potato & Carrots - MRE Meat Meals Ready to Eat (1 Pack) Prepared Entree Fully Cooked, Shelf Stable Microwave Dinner,",$12.99 ,#100,https://www.amazon.com/Best-Sellers-Grocery-Gourmet-Food-Deli-Prepared-Foods/zgbs/grocery/18773724011/ref=zg_bs_nav_grocery_1
"Kosher For Passover Gluten Free Food, Beef Stuffed Cabbage Rolls in Gravy - MRE Meat Meals Ready to Eat (1 Pack) Prepared Entree Fully Cooked, Shelf Stable Microwave Dinner,",$12.99 ,#93,https://www.amazon.com/Best-Sellers-Grocery-Gourmet-Food-Deli-Prepared-Foods/zgbs/grocery/18773724011/ref=zg_bs_nav_grocery_1
Sanniti Spanish Caperberries (Caper Berries) in Vinegar and Salt Brine - 33.5 oz,$17.99 ,#71,https://www.amazon.com/Best-Sellers-Grocery-Gourmet-Food-Deli-Prepared-Foods/zgbs/grocery/18773724011/ref=zg_bs_nav_grocery_1
Solestado Muffuletta Olive Salad 33.9oz,$21.60 ,#98,https://www.amazon.com/Best-Sellers-Grocery-Gourmet-Food-Deli-Prepared-Foods/zgbs/grocery/18773724011/ref=zg_bs_nav_grocery_1
"Lucky Foods Seoul Kimchi (Pack of 1) Authentic Made to Order Korean Kimchi (Original, 28 oz) - Keto / Gluten Free / Non GMO",$24.98 ,#70,https://www.amazon.com/Best-Sellers-Grocery-Gourmet-Food-Deli-Prepared-Foods/zgbs/grocery/18773724011/ref=zg_bs_nav_grocery_1
"4th & Heart Original Grass-Fed Ghee, Keto, Pasture Raised, Non-GMO, Lactose Free, Certified Paleo -16 Ounce",$6.48 ,#8,https://www.amazon.com/Best-Sellers-Grocery-Gourmet-Food-Dairy-Eggs-Plant-Based-Alternatives/zgbs/grocery/371460011/ref=zg_bs_nav_grocery_1
"Nestle Coffee mate Coffee Creamer, Original, Liquid Creamer Singles, Non Dairy, No Refrigeration, Box of 360",$32.99 ,#11,https://www.amazon.com/Best-Sellers-Grocery-Gourmet-Food-Dairy-Eggs-Plant-Based-Alternatives/zgbs/grocery/371460011/ref=zg_bs_nav_grocery_1
"Whisps Cheese Crisps - Parmesan & Cheddar Cheese Snacks, Keto Snacks, 6-9g of Protein Per Bag, Low Carb, Gluten & Sugar Free, Great Tasting Healthy Snack, All Natural Cheese Crisps - Variety, .63 Oz (Pack of 12)",$17.99 ,#22,https://www.amazon.com/Best-Sellers-Grocery-Gourmet-Food-Dairy-Eggs-Plant-Based-Alternatives/zgbs/grocery/371460011/ref=zg_bs_nav_grocery_1
"Orgain Collagen Creamer with Organic Oatmilk Powder, French Vanilla - 10g of Hydrolyzed Grass-Fed Collagen, 1g of Sugar, Made with MCT, Avocado, and Coconut Oil, No Dairy or Soy, Non-GMO, 10 oz",$21.32 ,#2,https://www.amazon.com/Best-Sellers-Grocery-Gourmet-Food-Dairy-Eggs-Plant-Based-Alternatives/zgbs/grocery/371460011/ref=zg_bs_nav_grocery_1
,,,https://www.amazon.com/Best-Sellers-Grocery-Gourmet-Food-Dairy-Eggs-Plant-Based-Alternatives/zgbs/grocery/371460011/ref=zg_bs_nav_grocery_1
"Horizon Organic Shelf-Stable 1% Lowfat Milk Boxes with DHA Omega-3, Chocolate, 8 oz., 6 Pack (Pack 3)",$16.98 ,#7,https://www.amazon.com/Best-Sellers-Grocery-Gourmet-Food-Dairy-Eggs-Plant-Based-Alternatives/zgbs/grocery/371460011/ref=zg_bs_nav_grocery_1
"GoGo squeeZ yogurtZ Banana, 3 oz. (4 Pouches) - Kids Snacks Made from Real Yogurt & Fruit - Pantry Friendly Snack, No Fridge Needed - No Preservatives - Kosher Certified - Gluten Free Snacks for Kids",$3.12 ,#6,https://www.amazon.com/Best-Sellers-Grocery-Gourmet-Food-Dairy-Eggs-Plant-Based-Alternatives/zgbs/grocery/371460011/ref=zg_bs_nav_grocery_1
