(NOT A CASE) Muffuletta Olive Salad Mix,,#45,https://www.amazon.com/Best-Sellers-Grocery-Gourmet-Food-Fresh-Meal-Ingredient-Kits/zgbs/grocery/15709227011/ref=zg_bs_nav_grocery_1
Christmas And Happy New Year Care Package (50 Count) Men Woman Christmas Candy Stocking Stuffers Holiday Gifts for Coworker Christmas Care Package Office Christmas Gifts Holiday Candy Stocking Stuffer,,#44,https://www.amazon.com/Best-Sellers-Grocery-Gourmet-Food-Fresh-Meal-Ingredient-Kits/zgbs/grocery/15709227011/ref=zg_bs_nav_grocery_1
Old El Paso Soft Taco Bake Dinner Kit 8.4 oz Box (pack of 6),$25.38 ,#43,https://www.amazon.com/Best-Sellers-Grocery-Gourmet-Food-Fresh-Meal-Ingredient-Kits/zgbs/grocery/15709227011/ref=zg_bs_nav_grocery_1
"Good It's Gluten Free Korean Chili Meal Kit for 2 - Gluten Free, Dairy Free & Egg Free Batter, Seasoned Flour & Sauce - 100% Traceable Ingredients",$9.99 ,#58,https://www.amazon.com/Best-Sellers-Grocery-Gourmet-Food-Fresh-Meal-Ingredient-Kits/zgbs/grocery/15709227011/ref=zg_bs_nav_grocery_1
"Hormel Healthlabs Thick & Easy Frozen Pureed Meal Kits (Breakfast, 3 Course Mix and Match Pack of 9)",,#66,https://www.amazon.com/Best-Sellers-Grocery-Gourmet-Food-Fresh-Meal-Ingredient-Kits/zgbs/grocery/15709227011/ref=zg_bs_nav_grocery_1
Maine Red Hotdog Grill Package **Arrives Tomorrow (Tue-Sat)** 24 Maine Red Snapper Hotdogs and 24 Top Split Hotdog Rolls,,#71,https://www.amazon.com/Best-Sellers-Grocery-Gourmet-Food-Fresh-Meal-Ingredient-Kits/zgbs/grocery/15709227011/ref=zg_bs_nav_grocery_1
XMRE Meals 1300XT - 12 Menu Variety Case with Heaters (Meal Ready to Eat - Military Grade),,#52,https://www.amazon.com/Best-Sellers-Grocery-Gourmet-Food-Fresh-Meal-Ingredient-Kits/zgbs/grocery/15709227011/ref=zg_bs_nav_grocery_1
XMRE (Meals Ready to Eat) 2019 Pack Date - 2024 Best By Date - Single Menu (Asian Beef Strips with Veggies),,#53,https://www.amazon.com/Best-Sellers-Grocery-Gourmet-Food-Fresh-Meal-Ingredient-Kits/zgbs/grocery/15709227011/ref=zg_bs_nav_grocery_1
Food Network Kitchen Inspirations Shrimp Scampi Meal Kit (4 oz Box),,#55,https://www.amazon.com/Best-Sellers-Grocery-Gourmet-Food-Fresh-Meal-Ingredient-Kits/zgbs/grocery/15709227011/ref=zg_bs_nav_grocery_1
"Good It's Gluten Free Katsu Curry Meal Kit for 2 - Gluten Free, Dairy Free & Egg Free Batter, Crumb & Sauce - 100% Traceable Ingredients",$9.99 ,#77,https://www.amazon.com/Best-Sellers-Grocery-Gourmet-Food-Fresh-Meal-Ingredient-Kits/zgbs/grocery/15709227011/ref=zg_bs_nav_grocery_1
MRE Special Buy MRE - 5 Menus to Choose From (Beef Chili w/Beans),,#76,https://www.amazon.com/Best-Sellers-Grocery-Gourmet-Food-Fresh-Meal-Ingredient-Kits/zgbs/grocery/15709227011/ref=zg_bs_nav_grocery_1
Mother's Recipe Goan Chicken Xacuti,$6.95 ,#56,https://www.amazon.com/Best-Sellers-Grocery-Gourmet-Food-Fresh-Meal-Ingredient-Kits/zgbs/grocery/15709227011/ref=zg_bs_nav_grocery_1
MRE 3 pack Entrée Combinations (Entrées & Sides) - 1st Insp. Date 2022 (3pk Beef Goulash Combo),$27.99 ,#60,https://www.amazon.com/Best-Sellers-Grocery-Gourmet-Food-Fresh-Meal-Ingredient-Kits/zgbs/grocery/15709227011/ref=zg_bs_nav_grocery_1
Mother's Recipe Goan Chicken Cafreal,$7.19 ,#73,https://www.amazon.com/Best-Sellers-Grocery-Gourmet-Food-Fresh-Meal-Ingredient-Kits/zgbs/grocery/15709227011/ref=zg_bs_nav_grocery_1
"McCormick Steakhouse Complete Meal Seasoning Mix Kit, 1 oz",,#69,https://www.amazon.com/Best-Sellers-Grocery-Gourmet-Food-Fresh-Meal-Ingredient-Kits/zgbs/grocery/15709227011/ref=zg_bs_nav_grocery_1
"Perfect Earth Foods Perfect Earth Organic Gluten Free Pad Thai Meal Kit - 5.3 oz - 100 Percent USDA + ECOCERT Certified Organic, Vegan, Allergen Free",,#75,https://www.amazon.com/Best-Sellers-Grocery-Gourmet-Food-Fresh-Meal-Ingredient-Kits/zgbs/grocery/15709227011/ref=zg_bs_nav_grocery_1
"Ozark Outdoorz, LLC 2020 Pack Date/2025 Best by Date - XMRE 1300XT (Meals Ready to Eat) - Single Meal - Pick Your Own Menu (Beef Goulash)",,#70,https://www.amazon.com/Best-Sellers-Grocery-Gourmet-Food-Fresh-Meal-Ingredient-Kits/zgbs/grocery/15709227011/ref=zg_bs_nav_grocery_1
Food Network Kitchen Inspirations Spicy Szechuan-Style Chicken & Rice Meal Kit (6.3 oz Box),,#63,https://www.amazon.com/Best-Sellers-Grocery-Gourmet-Food-Fresh-Meal-Ingredient-Kits/zgbs/grocery/15709227011/ref=zg_bs_nav_grocery_1
Burgers' Smokehouse Gourmet Side Dish Selections (Baked Macaroni & Cheese),$54.99 ,#65,https://www.amazon.com/Best-Sellers-Grocery-Gourmet-Food-Fresh-Meal-Ingredient-Kits/zgbs/grocery/15709227011/ref=zg_bs_nav_grocery_1
House Oden no Moto (oden soup mix) 2.7oz (77.2g) x 5ea.,$39.85 ,#68,https://www.amazon.com/Best-Sellers-Grocery-Gourmet-Food-Fresh-Meal-Ingredient-Kits/zgbs/grocery/15709227011/ref=zg_bs_nav_grocery_1
"Takeout Kit, Japanese Spicy Miso Ramen Pantry Meal Kit - Just Add Protein, Serves 4",,#72,https://www.amazon.com/Best-Sellers-Grocery-Gourmet-Food-Fresh-Meal-Ingredient-Kits/zgbs/grocery/15709227011/ref=zg_bs_nav_grocery_1
The Miracle Meal Pre-filled Communion Cups and Wafer Set - Box of 250 x 3 - with 100% Trusted Concord Grape Juice & Wafer - Made in the USA - Premium Quality Guaranteed,$163.00 ,#74,https://www.amazon.com/Best-Sellers-Grocery-Gourmet-Food-Fresh-Meal-Ingredient-Kits/zgbs/grocery/15709227011/ref=zg_bs_nav_grocery_1
Chef's Fried Chicken Mix,$9.95 ,#61,https://www.amazon.com/Best-Sellers-Grocery-Gourmet-Food-Fresh-Meal-Ingredient-Kits/zgbs/grocery/15709227011/ref=zg_bs_nav_grocery_1
The Miracle Meal | 250 x 2 Boxes (500) Pre-filled Communion Cups with 100% Concord Grape Juice and wafer,,#51,https://www.amazon.com/Best-Sellers-Grocery-Gourmet-Food-Fresh-Meal-Ingredient-Kits/zgbs/grocery/15709227011/ref=zg_bs_nav_grocery_1
TWO (2) NEW MRE's 2020 - 2021 1st Insp. date - US Military Meals Ready-to-Eat w/FREE DESSERT! (Two 16's - Chicken Burrito Bowl),,#62,https://www.amazon.com/Best-Sellers-Grocery-Gourmet-Food-Fresh-Meal-Ingredient-Kits/zgbs/grocery/15709227011/ref=zg_bs_nav_grocery_1
"Keto noodle kit-Zero Carb Noodles+Thai Tom Yum Sauce-Gluten Free-Low Calories,Carbs-Packaged Meal Kit-Ready To Cook by Sunturi Foods",$13.99 ,#64,https://www.amazon.com/Best-Sellers-Grocery-Gourmet-Food-Fresh-Meal-Ingredient-Kits/zgbs/grocery/15709227011/ref=zg_bs_nav_grocery_1
"Takeout Kit, Japanese Tonkotsu Ramen Pantry Meal Kit - Just Add Protein, Serves 4",,#67,https://www.amazon.com/Best-Sellers-Grocery-Gourmet-Food-Fresh-Meal-Ingredient-Kits/zgbs/grocery/15709227011/ref=zg_bs_nav_grocery_1
Essential Baking Company (NOT A CASE) Organic Take & Bake Sourdough Bread,$4.71 ,#54,https://www.amazon.com/Best-Sellers-Grocery-Gourmet-Food-Fresh-Meal-Ingredient-Kits/zgbs/grocery/15709227011/ref=zg_bs_nav_grocery_1
Food Network Kitchen Inspirations Chicken Pad Thai Meal Kit (12 oz Box),,#57,https://www.amazon.com/Best-Sellers-Grocery-Gourmet-Food-Fresh-Meal-Ingredient-Kits/zgbs/grocery/15709227011/ref=zg_bs_nav_grocery_1
"Kosher Parve Mre, Meal Mart Amazing Meals Ready to Eat, Gefilte Fish in Jelled Broth (3 Pack) – Travel, Military, Emergency Survival Food – Prepared Fully Cooked, Microwave Dinner, Shelf Stable",,#59,https://www.amazon.com/Best-Sellers-Grocery-Gourmet-Food-Fresh-Meal-Ingredient-Kits/zgbs/grocery/15709227011/ref=zg_bs_nav_grocery_1
"The Jackfruit Company, Complete Jackfruit Meal Indian, 10 Ounce",,#78,https://www.amazon.com/Best-Sellers-Grocery-Gourmet-Food-Fresh-Meal-Ingredient-Kits/zgbs/grocery/15709227011/ref=zg_bs_nav_grocery_1
NEW Spicy Chicken Taco Z-Ration (Zombie MRE) Full Meal!,$15.99 ,#81,https://www.amazon.com/Best-Sellers-Grocery-Gourmet-Food-Fresh-Meal-Ingredient-Kits/zgbs/grocery/15709227011/ref=zg_bs_nav_grocery_1
2018 Pack Date/2024 Best By Date-MRE Pizza Meal Kits (ENTREE ONLY with Utensil and Heater) (3 Pack),,#87,https://www.amazon.com/Best-Sellers-Grocery-Gourmet-Food-Fresh-Meal-Ingredient-Kits/zgbs/grocery/15709227011/ref=zg_bs_nav_grocery_1
"Zero carb keto noodles with Pad Thai keto sauce-Gluten free low calories,carbs noodle kit-Packaged meal kit ready to eat by Sunturi keto",,#93,https://www.amazon.com/Best-Sellers-Grocery-Gourmet-Food-Fresh-Meal-Ingredient-Kits/zgbs/grocery/15709227011/ref=zg_bs_nav_grocery_1
KNORR SHANGHAI STYLE HOT AND SOUR CHICKEN SOUP,,#94,https://www.amazon.com/Best-Sellers-Grocery-Gourmet-Food-Fresh-Meal-Ingredient-Kits/zgbs/grocery/15709227011/ref=zg_bs_nav_grocery_1
"Perfect Earth Foods Organic Gluten Free Laksa Curry Meal Kit - 7 oz - 100 USDA + ECOCERT Certified Organic, Vegan, Allergen Free",$7.49 ,#89,https://www.amazon.com/Best-Sellers-Grocery-Gourmet-Food-Fresh-Meal-Ingredient-Kits/zgbs/grocery/15709227011/ref=zg_bs_nav_grocery_1
Thai Boat Noodle Meal Kit,$13.99 ,#82,https://www.amazon.com/Best-Sellers-Grocery-Gourmet-Food-Fresh-Meal-Ingredient-Kits/zgbs/grocery/15709227011/ref=zg_bs_nav_grocery_1
Upton’s Naturals Real Meal Kit - 9.17 oz (Pack of 6) (Thai Spaghetti),,#80,https://www.amazon.com/Best-Sellers-Grocery-Gourmet-Food-Fresh-Meal-Ingredient-Kits/zgbs/grocery/15709227011/ref=zg_bs_nav_grocery_1
Hormel Health Lab THICK & EASY Purees Roasted Chicken with Potatoes & Carrots 7 oz,,#96,https://www.amazon.com/Best-Sellers-Grocery-Gourmet-Food-Fresh-Meal-Ingredient-Kits/zgbs/grocery/15709227011/ref=zg_bs_nav_grocery_1
"Old El Paso Stand 'N Stuff Hard and Soft Taco Dinner Kit, 9.4 oz",$12.98 ,#100,https://www.amazon.com/Best-Sellers-Grocery-Gourmet-Food-Fresh-Meal-Ingredient-Kits/zgbs/grocery/15709227011/ref=zg_bs_nav_grocery_1
NEW Spicy Chicken Taco Z-Ration (Zombie MRE) Full Meal!,$15.99 ,#81,https://www.amazon.com/Best-Sellers-Grocery-Gourmet-Food-Fresh-Meal-Ingredient-Kits/zgbs/grocery/15709227011/ref=zg_bs_nav_grocery_1
"Takeout Kit, Pad Thai Pantry Meal Kit - Just Add Protein, Serves 4",,#92,https://www.amazon.com/Best-Sellers-Grocery-Gourmet-Food-Fresh-Meal-Ingredient-Kits/zgbs/grocery/15709227011/ref=zg_bs_nav_grocery_1
"Kitchen & Love Artichoke, Lemon, and Roasted Garlic Farro Quick Meal, Single",$8.48 ,#83,https://www.amazon.com/Best-Sellers-Grocery-Gourmet-Food-Fresh-Meal-Ingredient-Kits/zgbs/grocery/15709227011/ref=zg_bs_nav_grocery_1
Pack of 10 SOPAKCO Sure-Pak MRE Reduced Sodium Emergency Ration Meals - Ready to Eat Variety Factory Sealed,,#90,https://www.amazon.com/Best-Sellers-Grocery-Gourmet-Food-Fresh-Meal-Ingredient-Kits/zgbs/grocery/15709227011/ref=zg_bs_nav_grocery_1
KIDS MRE (for a BOY) * Full Meal * Several Entrée Options w/ Play Pack & more! (11.25oz Beef Chili w/Beans (not spicy)),$13.99 ,#91,https://www.amazon.com/Best-Sellers-Grocery-Gourmet-Food-Fresh-Meal-Ingredient-Kits/zgbs/grocery/15709227011/ref=zg_bs_nav_grocery_1
"Asante Plant Based Meals - Plant Based Ceviche - Ready Meal Kits - Vegetarian Food, Healthy, Vegan – Fish Meat Substitute with Authentic Mexican Flavor - All Natural Fresh and Organic Ingredients",,#98,https://www.amazon.com/Best-Sellers-Grocery-Gourmet-Food-Fresh-Meal-Ingredient-Kits/zgbs/grocery/15709227011/ref=zg_bs_nav_grocery_1
(NOT A CASE) Organic Amaranth + Quinoa-Bread,$3.07 ,#88,https://www.amazon.com/Best-Sellers-Grocery-Gourmet-Food-Fresh-Meal-Ingredient-Kits/zgbs/grocery/15709227011/ref=zg_bs_nav_grocery_1
2017 Pack Date - Sopakco - Low Sodium MRE (Meals-Ready-To-East) - Single Meals (Cheese Tort),$19.50 ,#79,https://www.amazon.com/Best-Sellers-Grocery-Gourmet-Food-Fresh-Meal-Ingredient-Kits/zgbs/grocery/15709227011/ref=zg_bs_nav_grocery_1
Upton’s Naturals Real Meal Kit - 9.17 oz (Pack of 6) (Thai Spaghetti),,#80,https://www.amazon.com/Best-Sellers-Grocery-Gourmet-Food-Fresh-Meal-Ingredient-Kits/zgbs/grocery/15709227011/ref=zg_bs_nav_grocery_1
"Tamale - Tamal de Frijol – Bean Tamale | ready to eat (250g / 8.8 Oz) | no refrigeration required | Sugar Free, By El Carmen (6 Pack)",$26.98 ,#95,https://www.amazon.com/Best-Sellers-Grocery-Gourmet-Food-Fresh-Meal-Ingredient-Kits/zgbs/grocery/15709227011/ref=zg_bs_nav_grocery_1
(NOT A CASE) Lotus Cookies,,#99,https://www.amazon.com/Best-Sellers-Grocery-Gourmet-Food-Fresh-Meal-Ingredient-Kits/zgbs/grocery/15709227011/ref=zg_bs_nav_grocery_1
"Takeout Kit, Italian Truffle Risotto Pantry Meal Kit, Serves 4",,#84,https://www.amazon.com/Best-Sellers-Grocery-Gourmet-Food-Fresh-Meal-Ingredient-Kits/zgbs/grocery/15709227011/ref=zg_bs_nav_grocery_1
"Takeout Kit, Moroccan Shakshuka (Moroccan Baked Eggs) Pantry Meal Kit - Just Add Eggs, Serves 4",,#86,https://www.amazon.com/Best-Sellers-Grocery-Gourmet-Food-Fresh-Meal-Ingredient-Kits/zgbs/grocery/15709227011/ref=zg_bs_nav_grocery_1
Country Ham Breakfast Meal Kit With Biscuit Mix - Grits And Jelly Flavor of Your Choice (Apple Butter Sugar-Free),$35.99 ,#85,https://www.amazon.com/Best-Sellers-Grocery-Gourmet-Food-Fresh-Meal-Ingredient-Kits/zgbs/grocery/15709227011/ref=zg_bs_nav_grocery_1
Parisella Pizza Bella Artisan At-Home Pizza Making Kit for Authentic Italian Pizza - Make Homemade Pizza with Tomato Pizza Sauce and Pizza Flour for Family Cooking - Pizza Ingredients Set with Recipe,,#97,https://www.amazon.com/Best-Sellers-Grocery-Gourmet-Food-Fresh-Meal-Ingredient-Kits/zgbs/grocery/15709227011/ref=zg_bs_nav_grocery_1
"Jack Link's Beef Jerky, 5 Count Multipack Bags - Flavorful Meat Snack for Lunches, Ready to Eat - 7g of Protein, Made with Premium Beef - Original, 0.625 Oz Bags (Packaging May Vary)",$5.99 ,#1,https://www.amazon.com/Best-Sellers-Grocery-Gourmet-Food-Meat-Seafood/zgbs/grocery/371469011/ref=zg_bs_nav_grocery_1
"Slim Jim Giant Dill Pickle Smoked Meat Snack Sticks, 0.97 oz. 24-Count",$20.48 ,#16,https://www.amazon.com/Best-Sellers-Grocery-Gourmet-Food-Meat-Seafood/zgbs/grocery/371469011/ref=zg_bs_nav_grocery_1
"Cattleman's Cut Classic Smoked Frontier Style Beef Jerky, 6 Ounce",$12.99 ,#7,https://www.amazon.com/Best-Sellers-Grocery-Gourmet-Food-Meat-Seafood/zgbs/grocery/371469011/ref=zg_bs_nav_grocery_1
"Beef Jerky Gift Baskets for Men: Healthy Exotic Jerky Gift Box Includes Variety Of Pork Rinds, Venison, Chicken, Elk, Pork & Beef Meat Sticks - Great Gifts For Men",$37.99 ,#24,https://www.amazon.com/Best-Sellers-Grocery-Gourmet-Food-Meat-Seafood/zgbs/grocery/371469011/ref=zg_bs_nav_grocery_1
"Jack Link’s Beef Jerky, Jalapeno, 5.85 oz. Sharing Size Bag – Meat Snack with a Hint of Jalapenos and Red Chiles, 10g of Protein, 80 Calories, Made with Premium Beef (Packaging May Vary)",$7.99 ,#12,https://www.amazon.com/Best-Sellers-Grocery-Gourmet-Food-Meat-Seafood/zgbs/grocery/371469011/ref=zg_bs_nav_grocery_1
"HORMEL COMPLEATS Beef Pot Roast Microwave Tray, 9 Ounces (Pack of 6)",$13.39 ,#11,https://www.amazon.com/Best-Sellers-Grocery-Gourmet-Food-Meat-Seafood/zgbs/grocery/371469011/ref=zg_bs_nav_grocery_1
"StarKist 25% Less Sodium Premium White Chicken, 2.6 Oz Pouch, 2.6 Oz",$1.99 ,#15,https://www.amazon.com/Best-Sellers-Grocery-Gourmet-Food-Meat-Seafood/zgbs/grocery/371469011/ref=zg_bs_nav_grocery_1
"The New Primal, Buffalo Chicken Meat Stick, Free-Range Chicken, Paleo, Keto & Whole30 Approved, Chicken Jerky, Gluten, Dairy & Soy Free, 1 oz, Pack of 20",$34.99 ,#3,https://www.amazon.com/Best-Sellers-Grocery-Gourmet-Food-Meat-Seafood/zgbs/grocery/371469011/ref=zg_bs_nav_grocery_1
"Old Wisconsin Snack Sticks, Beef, 5-Ounce Package",$3.29 ,#6,https://www.amazon.com/Best-Sellers-Grocery-Gourmet-Food-Meat-Seafood/zgbs/grocery/371469011/ref=zg_bs_nav_grocery_1
,,,https://www.amazon.com/Best-Sellers-Grocery-Gourmet-Food-Meat-Seafood/zgbs/grocery/371469011/ref=zg_bs_nav_grocery_1
"Old Wisconsin Pepperoni Sausage Snack Sticks, Naturally Smoked, Ready to Eat, High Protein, Low Carb, Keto, Gluten Free, 28 Ounce Resealable Package",$14.48 ,#25,https://www.amazon.com/Best-Sellers-Grocery-Gourmet-Food-Meat-Seafood/zgbs/grocery/371469011/ref=zg_bs_nav_grocery_1
"Real Hardwood Smoked Sausages, Original Beef, 15.2 Ounce Tall Jar (20 Count)",$14.99 ,#5,https://www.amazon.com/Best-Sellers-Grocery-Gourmet-Food-Meat-Seafood/zgbs/grocery/371469011/ref=zg_bs_nav_grocery_1
"Old Wisconsin Honey Brown Sugar Turkey Sausage Snack Sticks, Naturally Smoked, Ready to Eat, High Protein, Low Carb, Keto, Gluten Free, 16 Ounce Resealable Package, Honey Turkey",$10.80 ,#4,https://www.amazon.com/Best-Sellers-Grocery-Gourmet-Food-Meat-Seafood/zgbs/grocery/371469011/ref=zg_bs_nav_grocery_1
Mission Meats Habanero Spicy Snacks Sugar Free Keto Snacks Grass Fed Beef Sticks Whole 30 Gluten Free MSG Free Paleo Healthy Snacks Meat Sticks Beef Jerky Zero Sugar Protein Snacks,$23.95 ,#21,https://www.amazon.com/Best-Sellers-Grocery-Gourmet-Food-Meat-Seafood/zgbs/grocery/371469011/ref=zg_bs_nav_grocery_1
"Jack Link'S Beef Jerky, Jalapeno, Spicy Meat Snack – Great For Lunches, 12G Protein And 100 Calories, Made With 100% Beef - 94% Fat-Free, No Added Msg** Or Nitrates/Nitrites, 1.25 Oz (Pack Of 10)",$23.04 ,#27,https://www.amazon.com/Best-Sellers-Grocery-Gourmet-Food-Meat-Seafood/zgbs/grocery/371469011/ref=zg_bs_nav_grocery_1
"Old Wisconsin Premium Summer Sausage, 100% Natural Meat, Charcuterie, Ready to Eat, High Protein, Low Carb, Keto, Gluten Free, Original Flavor, 16 Ounce",$6.99 ,#29,https://www.amazon.com/Best-Sellers-Grocery-Gourmet-Food-Meat-Seafood/zgbs/grocery/371469011/ref=zg_bs_nav_grocery_1
"Jack Link’s Jalapeno Beef & Cheese Combo Snack Pack, 1.2 Oz, Pack of 16 - 100% Beef Stick and Cheese Stick Made with Real Wisconsin Cheese - 7g Protein",$16.50 ,#26,https://www.amazon.com/Best-Sellers-Grocery-Gourmet-Food-Meat-Seafood/zgbs/grocery/371469011/ref=zg_bs_nav_grocery_1
"Perky Jerky Brewmaster's Pale Ale Turkey Jerky, 14oz - Low Sodium - 10g Protein per Serving - Low Fat - 100% U.S. Sourced - Tender Texture and Bold Flavor",$29.55 ,#31,https://www.amazon.com/Best-Sellers-Grocery-Gourmet-Food-Meat-Seafood/zgbs/grocery/371469011/ref=zg_bs_nav_grocery_1
"Jack Link’s Premium Cuts Beef Steak, BBQ Recipe, Great Protein Snack with 16g of Protein and 13g of Carbs per Serving, Made with Premium Beef, 2 Ounce (Pack of 12)",$19.92 ,#22,https://www.amazon.com/Best-Sellers-Grocery-Gourmet-Food-Meat-Seafood/zgbs/grocery/371469011/ref=zg_bs_nav_grocery_1
"SNOW'S BY BUMBLE BEE All Natural Clam Juice, 8 Ounce Bottle (Pack of 12), Pure Bottled Clam Juice",$9.98 ,#33,https://www.amazon.com/Best-Sellers-Grocery-Gourmet-Food-Meat-Seafood/zgbs/grocery/371469011/ref=zg_bs_nav_grocery_1
"Old Wisconsin Premium Summer Sausage, 100% Natural Meat, Charcuterie, Ready to Eat, High Protein, Low Carb, Keto, Gluten Free, Beef Flavor, 16 Ounce",$6.99 ,#18,https://www.amazon.com/Best-Sellers-Grocery-Gourmet-Food-Meat-Seafood/zgbs/grocery/371469011/ref=zg_bs_nav_grocery_1
"Nutristore Freeze-Dried Chicken | Emergency Survival Bulk Food Storage Meat | Perfect for Lightweight Backpacking, Camping & Home Meals | USDA Inspected | 25-Year Shelf Life",$54.99 ,#20,https://www.amazon.com/Best-Sellers-Grocery-Gourmet-Food-Meat-Seafood/zgbs/grocery/371469011/ref=zg_bs_nav_grocery_1
"The Sausage Maker - North American Natural Hog Casings for Home Sausage Making, Make 25 lbs. of Standard Italian, Polish and Bratwurst at about ~1.5” Stuffed Diameter Links (1)",$10.50 ,#32,https://www.amazon.com/Best-Sellers-Grocery-Gourmet-Food-Meat-Seafood/zgbs/grocery/371469011/ref=zg_bs_nav_grocery_1
"Chicken of the Sea Sardines, Extra Virgin Olive Oil, 3.75 oz (Pack of 18)",$10.99 ,#17,https://www.amazon.com/Best-Sellers-Grocery-Gourmet-Food-Meat-Seafood/zgbs/grocery/371469011/ref=zg_bs_nav_grocery_1
"Jack Links Premium Cuts Beef Steak, Original, Strips -Great Protein Snack with 11g of Protein and 1g of Carbs Per Serving, Made with Beef, 1 Ounce (Pack of 12)",$15.99 ,#8,https://www.amazon.com/Best-Sellers-Grocery-Gourmet-Food-Meat-Seafood/zgbs/grocery/371469011/ref=zg_bs_nav_grocery_1
Belveder Premium Wild Cod Liver in Own Oil from Iceland 120g/4.2 Oz | Natural Source of Omega-3 Fatty Acids (Pack of 3),$14.49 ,#30,https://www.amazon.com/Best-Sellers-Grocery-Gourmet-Food-Meat-Seafood/zgbs/grocery/371469011/ref=zg_bs_nav_grocery_1
"Slim Jim Monster Smoked Meat Sticks, Honey BBQ, Packed with Protein, 1.94 Oz. Sticks, 18 Count",$21.98 ,#10,https://www.amazon.com/Best-Sellers-Grocery-Gourmet-Food-Meat-Seafood/zgbs/grocery/371469011/ref=zg_bs_nav_grocery_1
"Old Wisconsin Beef Snack Sticks Counter Box, 42 Count",$22.53 ,#19,https://www.amazon.com/Best-Sellers-Grocery-Gourmet-Food-Meat-Seafood/zgbs/grocery/371469011/ref=zg_bs_nav_grocery_1
Natural Hog Casings for Sausage by Oversea Casing,$8.36 ,#23,https://www.amazon.com/Best-Sellers-Grocery-Gourmet-Food-Meat-Seafood/zgbs/grocery/371469011/ref=zg_bs_nav_grocery_1
"Duke's Hatch Green Chile Smoked Shorty Sausages, Gluten Free, < 1g total sugar, 16 Ounce",$14.34 ,#13,https://www.amazon.com/Best-Sellers-Grocery-Gourmet-Food-Meat-Seafood/zgbs/grocery/371469011/ref=zg_bs_nav_grocery_1
"Chicken of the Sea Pink Salmon, Cracked Pepper, 30 Ounce (Pack of 1)",$17.64 ,#14,https://www.amazon.com/Best-Sellers-Grocery-Gourmet-Food-Meat-Seafood/zgbs/grocery/371469011/ref=zg_bs_nav_grocery_1
"Wild Planet Ready-To-Eat Wild Tuna Pasta Salad With Organic Red Peppers, Tomatoes & Green Olives, 5.6oz, (Pack Of 4), 4Count",$15.98 ,#28,https://www.amazon.com/Best-Sellers-Grocery-Gourmet-Food-Meat-Seafood/zgbs/grocery/371469011/ref=zg_bs_nav_grocery_1
"Nutristore Freeze-Dried Sausage Crumbles | Emergency Survival Bulk Food Storage | Premium Quality Meat | Perfect for Lightweight Backpacking, Camping, Home Meals | USDA Inspected | 25 Year Shelf-Life",$59.99 ,#34,https://www.amazon.com/Best-Sellers-Grocery-Gourmet-Food-Meat-Seafood/zgbs/grocery/371469011/ref=zg_bs_nav_grocery_1
"Jack Link's Beef Jerky, Original, ½ Pounder Bag - Flavorful Meat Snack, 10g of Protein and 80 Calories, Made with Premium Beef - 96% Fat Free, No Added MSG or Nitrates/Nitrites (Packaging May Vary)",$11.18 ,#2,https://www.amazon.com/Best-Sellers-Grocery-Gourmet-Food-Meat-Seafood/zgbs/grocery/371469011/ref=zg_bs_nav_grocery_1
"Jack Link's Bacon Jerky, Hickory Smoked, 2.5 oz. Bag - Flavorful Ready to Eat Meat Snack with 11g of Protein, Made with 100% Thick Cut, Real Bacon - Trans Fat Free (Packaging May Vary)",$4.98 ,#9,https://www.amazon.com/Best-Sellers-Grocery-Gourmet-Food-Meat-Seafood/zgbs/grocery/371469011/ref=zg_bs_nav_grocery_1
Nutristore Freeze-Dried Pulled Pork | Premium Quality Pre-Cooked Meat | Survival Emergency Food Supply | Meat for Home Meals & Lightweight Camping | USDA Inspected | 25-Year Shelf Life (1-Pack),$59.99 ,#36,https://www.amazon.com/Best-Sellers-Grocery-Gourmet-Food-Meat-Seafood/zgbs/grocery/371469011/ref=zg_bs_nav_grocery_1
"Hickory Farms Meat & Cheese Large Gift Box | Gourmet Food Gift Basket Perfect For Family, Birthday, Sympathy, Congratulations Gifts, Retirement, Thinking of You, Business and Corporate Gifts",$39.99 ,#41,https://www.amazon.com/Best-Sellers-Grocery-Gourmet-Food-Meat-Seafood/zgbs/grocery/371469011/ref=zg_bs_nav_grocery_1
"Bumble Bee Chunk White Albacore Tuna in Water, 5 oz Cans (Pack of 4) - Wild Caught Tuna - 20g Protein per Serving - Non-GMO Project Verified, Gluten Free, Kosher - Great for Tuna Salad & Recipes",$5.68 ,#45,https://www.amazon.com/Best-Sellers-Grocery-Gourmet-Food-Meat-Seafood/zgbs/grocery/371469011/ref=zg_bs_nav_grocery_1
"Jack Link’s Beef Jerky Chew, Shredded Beef Jerky, Made with Premium Beef, Original Flavor, 0.32 Oz Per Snack Tin, 11.52 Ounce Total (Pack of 36)",$37.80 ,#48,https://www.amazon.com/Best-Sellers-Grocery-Gourmet-Food-Meat-Seafood/zgbs/grocery/371469011/ref=zg_bs_nav_grocery_1
"Sea Best Bay Scallops, 16 Ounce",$15.10 ,#50,https://www.amazon.com/Best-Sellers-Grocery-Gourmet-Food-Meat-Seafood/zgbs/grocery/371469011/ref=zg_bs_nav_grocery_1
"Vermont Smoke and Cure Original Mini Meat Stick Go Pack, Beef & Pork, Antibiotic Free, Gluten Free, (Packaging may vary), Cracked Pepper Beef & Pork, 0.5 Ounce (Pack of 6), 3 Ounce",$5.16 ,#38,https://www.amazon.com/Best-Sellers-Grocery-Gourmet-Food-Meat-Seafood/zgbs/grocery/371469011/ref=zg_bs_nav_grocery_1
Curing Salt No.1. Quick Cure Premium Prague Powder XL 1.5 Pound Bottle by SPQR Seasonings,$11.89 ,#47,https://www.amazon.com/Best-Sellers-Grocery-Gourmet-Food-Meat-Seafood/zgbs/grocery/371469011/ref=zg_bs_nav_grocery_1
"Zatarain's Crawfish, Shrimp & Crab Boil, 16 oz",$6.20 ,#37,https://www.amazon.com/Best-Sellers-Grocery-Gourmet-Food-Meat-Seafood/zgbs/grocery/371469011/ref=zg_bs_nav_grocery_1
"Wild Planet, Salmon, 3 ounce, Pink, Salt",$3.00 ,#40,https://www.amazon.com/Best-Sellers-Grocery-Gourmet-Food-Meat-Seafood/zgbs/grocery/371469011/ref=zg_bs_nav_grocery_1
"Snack Mates by The New Primal, Chicken & Maple Stick, All-Natural Chicken, High Protein and Low Sugar Kids Snack, Certified Paleo, Certified Gluten-Free, Lunchbox Friendly, 5 (0.5 oz) Sticks Per Pack (8 Pack)",$11.95 ,#39,https://www.amazon.com/Best-Sellers-Grocery-Gourmet-Food-Meat-Seafood/zgbs/grocery/371469011/ref=zg_bs_nav_grocery_1
"Armour Star Chicken Vienna Sausage Bites, Canned Sausage, 10 OZ (Pack of 12)",$12.00 ,#44,https://www.amazon.com/Best-Sellers-Grocery-Gourmet-Food-Meat-Seafood/zgbs/grocery/371469011/ref=zg_bs_nav_grocery_1
LEM Products 141 8 oz. Vacuum Sealed Bag - Hog Casings for 25 lbs. Meat,$10.99 ,#46,https://www.amazon.com/Best-Sellers-Grocery-Gourmet-Food-Meat-Seafood/zgbs/grocery/371469011/ref=zg_bs_nav_grocery_1
"Kirkland Signature Chicken Breast, 12.5 Ounce (6) (Pack of 6)",$27.24 ,#42,https://www.amazon.com/Best-Sellers-Grocery-Gourmet-Food-Meat-Seafood/zgbs/grocery/371469011/ref=zg_bs_nav_grocery_1
"Safe Catch Elite Lowest-Mercury Canned Solid Wild Tuna Fish Steak, Every Fish Is Tested, Gluten-Free, Paleo, Keto, Kosher, Non-GMO, High Protein Food, 5oz Cans, Pack of 6",$19.00 ,#43,https://www.amazon.com/Best-Sellers-Grocery-Gourmet-Food-Meat-Seafood/zgbs/grocery/371469011/ref=zg_bs_nav_grocery_1
"Armour Star Pork Luncheon Meat, Canned Meat, 12 OZ (Pack of 12)",$24.60 ,#49,https://www.amazon.com/Best-Sellers-Grocery-Gourmet-Food-Meat-Seafood/zgbs/grocery/371469011/ref=zg_bs_nav_grocery_1
"Slim Jim Mild Smoked Snack Stick, 0.28 Oz 14 units",$3.42 ,#35,https://www.amazon.com/Best-Sellers-Grocery-Gourmet-Food-Meat-Seafood/zgbs/grocery/371469011/ref=zg_bs_nav_grocery_1
