"Enfagrow Premium Toddler Nutritional Drink 24 oz. Powder Can, Dual Prebiotics for Immune Support, DHA for Brain Development, Iron, Non-GMO, Natural Milk Flavor (Former Toddler Next Step) from Enfamil",$18.99 ,#82,https://www.amazon.com/Best-Sellers-Grocery-Gourmet-Food-Baby-Foods/zgbs/grocery/16323111/ref=zg_bs_nav_grocery_1
"PurAmino Hypoallergenic Infant Drink, for Severe Food Allergies, Omega-3 DHA, Iron, Immune Support, Powder Can, 14.1 Oz (Pack of 4)",,#90,https://www.amazon.com/Best-Sellers-Grocery-Gourmet-Food-Baby-Foods/zgbs/grocery/16323111/ref=zg_bs_nav_grocery_1
"Plum Organics Baby Food Pouch | Stage 1 | Just Prunes | 4 Ounce | 12 Pack | Organic Food Squeeze for Babies, Kids, Toddlers",$14.27 ,#68,https://www.amazon.com/Best-Sellers-Grocery-Gourmet-Food-Baby-Foods/zgbs/grocery/16323111/ref=zg_bs_nav_grocery_1
"Cerebelly Toddler Snack Bars – Apple Kale (Pack of 5), Healthy & Organic Whole Grain Bars with Veggies & Fruit, 15 Brain-supporting Nutrients from Superfoods, Nut Free, No Added Sugar, Made with Gluten Free Ingredients",$5.75 ,#86,https://www.amazon.com/Best-Sellers-Grocery-Gourmet-Food-Baby-Foods/zgbs/grocery/16323111/ref=zg_bs_nav_grocery_1
"Earth's Best Organic Sesame Street Sunny Days Toddler Snack Bars, Apple, 7 Count (Pack of 6)",$21.48 ,#61,https://www.amazon.com/Best-Sellers-Grocery-Gourmet-Food-Baby-Foods/zgbs/grocery/16323111/ref=zg_bs_nav_grocery_1
"Similac NeoSure Infant Formula with Iron, For Babies Born Prematurely, Ready-to-Feed bottles, 1 qt (Pack of 6)",$58.14 ,#88,https://www.amazon.com/Best-Sellers-Grocery-Gourmet-Food-Baby-Foods/zgbs/grocery/16323111/ref=zg_bs_nav_grocery_1
"Gerber Pick-ups Cheese & Spinach Ravioli, 6 Ounce (Pack of 8)",$13.92 ,#51,https://www.amazon.com/Best-Sellers-Grocery-Gourmet-Food-Baby-Foods/zgbs/grocery/16323111/ref=zg_bs_nav_grocery_1
"Enfamil Baby Vitamin D-Vi-Sol Vitamin D Liquid Supplement Drops for Infants, Supporting Strong Teeth & bones in Newborn Babies, Easy-to-Use, Gluten-Free, 50 mL Dropper Bottle, Pack of 3",$10.16 ,#75,https://www.amazon.com/Best-Sellers-Grocery-Gourmet-Food-Baby-Foods/zgbs/grocery/16323111/ref=zg_bs_nav_grocery_1
"Enfamil Reguline Baby Formula, Designed for Soft, Comfortable Stools, with Omega-3 DHA & Probiotics for Immune Support, Reusable Powder Tub, 19.5 Oz",$29.98 ,#70,https://www.amazon.com/Best-Sellers-Grocery-Gourmet-Food-Baby-Foods/zgbs/grocery/16323111/ref=zg_bs_nav_grocery_1
"Pedialyte Electrolyte Water with Zero Sugar, Hydration with 3 Key Electrolytes & Zinc for Immune Support, Berry Frost, 1 Liter, 4 Count",$19.92 ,#94,https://www.amazon.com/Best-Sellers-Grocery-Gourmet-Food-Baby-Foods/zgbs/grocery/16323111/ref=zg_bs_nav_grocery_1
"Similac 360 Total Care Sensitive Infant Formula, with 5 HMO Prebiotics for Fussiness & Gas Due to Lactose Sensitivity, Non-GMO, Baby Formula, Ready-to-Feed, 8 Fl Oz, Pack of 24",$67.28 ,#64,https://www.amazon.com/Best-Sellers-Grocery-Gourmet-Food-Baby-Foods/zgbs/grocery/16323111/ref=zg_bs_nav_grocery_1
"Enfamil Infant Formula, Milk-based Baby Formula with Iron, Omega-3 DHA & Choline, Powder Can, 21.1 Oz, Pack of 4 (Total 84.4 Oz)",$99.92 ,#77,https://www.amazon.com/Best-Sellers-Grocery-Gourmet-Food-Baby-Foods/zgbs/grocery/16323111/ref=zg_bs_nav_grocery_1
"Nestle Nan Baby Formula Powder, 28.2 Ounces",$17.98 ,#80,https://www.amazon.com/Best-Sellers-Grocery-Gourmet-Food-Baby-Foods/zgbs/grocery/16323111/ref=zg_bs_nav_grocery_1
"Gerber Baby Food, Yogurt Blends for Crawler Banana, 3.5 Ounce - 4 Count (Pack of 6)",$21.51 ,#81,https://www.amazon.com/Best-Sellers-Grocery-Gourmet-Food-Baby-Foods/zgbs/grocery/16323111/ref=zg_bs_nav_grocery_1
"Amazon Brand - Mama Bear Organic Baby Food, Stage 2, Apple Banana Yogurt Strawberry, 4 Ounce Pouch (Pack of 12)",$15.36 ,#72,https://www.amazon.com/Best-Sellers-Grocery-Gourmet-Food-Baby-Foods/zgbs/grocery/16323111/ref=zg_bs_nav_grocery_1
Nestle NIDO Lacto-Ease Toddler Powdered Milk Beverage - 28.2 Oz Canister - Toddler Drink Mix,$11.12 ,#96,https://www.amazon.com/Best-Sellers-Grocery-Gourmet-Food-Baby-Foods/zgbs/grocery/16323111/ref=zg_bs_nav_grocery_1
"Pedialyte Electrolyte Powder, Cherry, Electrolyte Hydration Drink, 0.6 oz Powder Packs (18 Count)",$26.97 ,#52,https://www.amazon.com/Best-Sellers-Grocery-Gourmet-Food-Baby-Foods/zgbs/grocery/16323111/ref=zg_bs_nav_grocery_1
"Happy Tot Organics Love My Veggies Stage 4, Organics Spinach Apple Sweet Potato & Kiwi, 4.22 Ounce Pouch (Pack of 16) packaging may vary",$21.96 ,#97,https://www.amazon.com/Best-Sellers-Grocery-Gourmet-Food-Baby-Foods/zgbs/grocery/16323111/ref=zg_bs_nav_grocery_1
"Pedialyte AdvancedCare Plus Electrolyte Powder, with 33% More Electrolytes and PreActiv Prebiotics, Orange Breeze, Electrolyte Drink Powder Packets, 0.6 oz, 6 Count",$10.87 ,#89,https://www.amazon.com/Best-Sellers-Grocery-Gourmet-Food-Baby-Foods/zgbs/grocery/16323111/ref=zg_bs_nav_grocery_1
"Similac® Advance®* Infant Formula with Iron, 6 Count, Ready-to-Feed, 32-Fl Oz Bottle",$43.38 ,#58,https://www.amazon.com/Best-Sellers-Grocery-Gourmet-Food-Baby-Foods/zgbs/grocery/16323111/ref=zg_bs_nav_grocery_1
"Pedialyte Electrolyte Powder, Electrolyte Hydration Drink Cherry 0.6 Ounce, 3.6 Ounce (Pack of 1)",$8.99 ,#79,https://www.amazon.com/Best-Sellers-Grocery-Gourmet-Food-Baby-Foods/zgbs/grocery/16323111/ref=zg_bs_nav_grocery_1
"Similac Soy Isomil Infant Formula with Iron, Powder, 30.8 oz (Pack of 4)",$147.84 ,#100,https://www.amazon.com/Best-Sellers-Grocery-Gourmet-Food-Baby-Foods/zgbs/grocery/16323111/ref=zg_bs_nav_grocery_1
"Puffworks Baby Organic Almond Butter Puffs, with Peanut Butter, Plant-Based Protein, USDA Organic, Gluten-Free, Vegan, Non-GMO, Kosher, 0.5 Ounce (Pack of 12)",$25.95 ,#99,https://www.amazon.com/Best-Sellers-Grocery-Gourmet-Food-Baby-Foods/zgbs/grocery/16323111/ref=zg_bs_nav_grocery_1
"Bittermilk Single Serve No.1 Bourbon Barrel Aged Old Fashioned Mix 5-Pack Bartender Gift Set – Old Fashioned Gift – Gift for Bourbon Drinker - Just Add Whiskey, Each Bottle Makes One Cocktail",$14.99 ,#6,https://www.amazon.com/Best-Sellers-Grocery-Gourmet-Food-Alcoholic-Beverages/zgbs/grocery/2983371011/ref=zg_bs_nav_grocery_1
Fee Brothers Black Walnut Bitters 5oz,$11.99 ,#11,https://www.amazon.com/Best-Sellers-Grocery-Gourmet-Food-Alcoholic-Beverages/zgbs/grocery/2983371011/ref=zg_bs_nav_grocery_1
Amenazel Soursop Bitters 16oz,$27.68 ,#3,https://www.amazon.com/Best-Sellers-Grocery-Gourmet-Food-Alcoholic-Beverages/zgbs/grocery/2983371011/ref=zg_bs_nav_grocery_1
"Strongwater Perfect Margarita Mix (Makes 8 Cocktails) - Ultra Concentrated, Coin Style, Premium Margarita Mixer, Made with Fresh Lime Juice & Orange Cointreau Extract - Just Add Tequila",$18.95 ,#4,https://www.amazon.com/Best-Sellers-Grocery-Gourmet-Food-Alcoholic-Beverages/zgbs/grocery/2983371011/ref=zg_bs_nav_grocery_1
"Athletic Brewing Company Craft NA - 12 Pack x 12 Fl Oz Cans - All Out Extra Dark - Low-Calorie, Award Winning - Delicate Coffee and Bittersweet Chocolate Notes",$29.99 ,#10,https://www.amazon.com/Best-Sellers-Grocery-Gourmet-Food-Alcoholic-Beverages/zgbs/grocery/2983371011/ref=zg_bs_nav_grocery_1
"Q Mixers Club Soda, Premium Club Soda, 6.7 Fl Oz (Pack of 24)",$21.48 ,#1,https://www.amazon.com/Best-Sellers-Grocery-Gourmet-Food-Alcoholic-Beverages/zgbs/grocery/2983371011/ref=zg_bs_nav_grocery_1
"Barsmith Bar Essentials Dirty Martini Mix with Freshly Pressed Olives, Rich and Salty Flavor, 12.7-oz. Bottle, Pack of 1",$3.65 ,#7,https://www.amazon.com/Best-Sellers-Grocery-Gourmet-Food-Alcoholic-Beverages/zgbs/grocery/2983371011/ref=zg_bs_nav_grocery_1
Boscoli Dirty Martini Olive Juice 12.7 ounces (Pack of 3),$26.99 ,#12,https://www.amazon.com/Best-Sellers-Grocery-Gourmet-Food-Alcoholic-Beverages/zgbs/grocery/2983371011/ref=zg_bs_nav_grocery_1
Top Hat Butterfly Truth Serum - Keto Friendly Zero Calorie Butterfly Flower Tea Infusion - Blue Tincture - Butterfly Blossom Bitters - Unsweetened - Zero Sugar - Make Cocktails Indigo Purple - 32oz Bottle,$22.98 ,#13,https://www.amazon.com/Best-Sellers-Grocery-Gourmet-Food-Alcoholic-Beverages/zgbs/grocery/2983371011/ref=zg_bs_nav_grocery_1
"Bartesian The Classic Collection Cocktail Mixer Capsules, Variety Pack of 6 Cocktail Capsules, for Bartesian Premium Cocktail Maker (55350)",$1.77 ,#2,https://www.amazon.com/Best-Sellers-Grocery-Gourmet-Food-Alcoholic-Beverages/zgbs/grocery/2983371011/ref=zg_bs_nav_grocery_1
"Bartesian Gimlet Cocktail Mixer Capsules, Pack of 6 Cocktail Capsules, for Bartesian Premium Cocktail Maker (55358)",$14.99 ,#8,https://www.amazon.com/Best-Sellers-Grocery-Gourmet-Food-Alcoholic-Beverages/zgbs/grocery/2983371011/ref=zg_bs_nav_grocery_1
"Mr & Mrs T Mai Tai Mix, 1 L bottles (Pack of 6)",$3.42 ,#9,https://www.amazon.com/Best-Sellers-Grocery-Gourmet-Food-Alcoholic-Beverages/zgbs/grocery/2983371011/ref=zg_bs_nav_grocery_1
"Fever-Tree Premium Tonic Water, Indian, 163.2 Fl Oz (Pack of 24)",$29.88 ,#5,https://www.amazon.com/Best-Sellers-Grocery-Gourmet-Food-Alcoholic-Beverages/zgbs/grocery/2983371011/ref=zg_bs_nav_grocery_1
,,,https://www.amazon.com/Best-Sellers-Grocery-Gourmet-Food-Alcoholic-Beverages/zgbs/grocery/2983371011/ref=zg_bs_nav_grocery_1
"Regan's Orange Bitters No. 6, 10 Ounces",$13.97 ,#39,https://www.amazon.com/Best-Sellers-Grocery-Gourmet-Food-Alcoholic-Beverages/zgbs/grocery/2983371011/ref=zg_bs_nav_grocery_1
Angostura Aromatic Bitters and Orange Bitters 4 Fl. oz. Set.,$25.00 ,#16,https://www.amazon.com/Best-Sellers-Grocery-Gourmet-Food-Alcoholic-Beverages/zgbs/grocery/2983371011/ref=zg_bs_nav_grocery_1
"Jordan's Skinny Mixes Cocktail Party in a Box, Sugar Free Cocktail Flavoring Mixers, 32 Ounce Bottle (Pack of 6)",$41.99 ,#41,https://www.amazon.com/Best-Sellers-Grocery-Gourmet-Food-Alcoholic-Beverages/zgbs/grocery/2983371011/ref=zg_bs_nav_grocery_1
"Filthy Food Olive Brine - Premium Cocktail Brine - Non-GMO, Vegan & Gluten Free - 8oz Pouches, 6 Count",$35.00 ,#44,https://www.amazon.com/Best-Sellers-Grocery-Gourmet-Food-Alcoholic-Beverages/zgbs/grocery/2983371011/ref=zg_bs_nav_grocery_1
"Bitters ""Triple Play"" Variety 3-Pack: Angostura, Peychauds and Regans",$27.43 ,#27,https://www.amazon.com/Best-Sellers-Grocery-Gourmet-Food-Alcoholic-Beverages/zgbs/grocery/2983371011/ref=zg_bs_nav_grocery_1
"ANGOSTURA Aromatic Bitters, 118 ml / 4 oz.",$13.79 ,#31,https://www.amazon.com/Best-Sellers-Grocery-Gourmet-Food-Alcoholic-Beverages/zgbs/grocery/2983371011/ref=zg_bs_nav_grocery_1
"Jordan's Skinny Mixes Cocktail Flavoring Mix, Piña colada, 32 Fl Oz",$8.49 ,#24,https://www.amazon.com/Best-Sellers-Grocery-Gourmet-Food-Alcoholic-Beverages/zgbs/grocery/2983371011/ref=zg_bs_nav_grocery_1
"Boscoli Family Dirty Martini Olive Juice, 12.7 oz.",$14.49 ,#37,https://www.amazon.com/Best-Sellers-Grocery-Gourmet-Food-Alcoholic-Beverages/zgbs/grocery/2983371011/ref=zg_bs_nav_grocery_1
"Dream Light by Kin Euphorics, Non Alcoholic Spirits, Nootropic, Botanic, Adaptogen Drink, Earthy Oak, Smoky Clove and Spicy Cinnamon, Soothe The Spirit and Quiet The Mind, 6.7 Fl Oz",$22.00 ,#15,https://www.amazon.com/Best-Sellers-Grocery-Gourmet-Food-Alcoholic-Beverages/zgbs/grocery/2983371011/ref=zg_bs_nav_grocery_1
"RITUAL ZERO PROOF Whiskey Alternative | Award-Winning Non-Alcoholic Spirit | 25.4 Fl Oz (750ml) | Only 10 Calories | Keto, Paleo & Low Carb Diet Friendly | Make Delicious Alcohol Free Cocktails",$29.99 ,#30,https://www.amazon.com/Best-Sellers-Grocery-Gourmet-Food-Alcoholic-Beverages/zgbs/grocery/2983371011/ref=zg_bs_nav_grocery_1
"Fever-Tree Tonic Water Glass Bottles, Elderflower, 6.8 Fl Oz (Pack of 24)",$39.53 ,#36,https://www.amazon.com/Best-Sellers-Grocery-Gourmet-Food-Alcoholic-Beverages/zgbs/grocery/2983371011/ref=zg_bs_nav_grocery_1
"High Rhode by Kin Euphorics, Non Alcoholic Spirits, Adaptogen, Nootropic, Botanical, Tart Citrus, Bitters and Spices, Caffeine, Rhodiola Rosea, Awaken The Mind, Uplift The Mood, 16.9 Fl Oz",$23.98 ,#22,https://www.amazon.com/Best-Sellers-Grocery-Gourmet-Food-Alcoholic-Beverages/zgbs/grocery/2983371011/ref=zg_bs_nav_grocery_1
SPIRITLESS Kentucky 74 | Non-Alcoholic Bourbon Whiskey Spirit | Fully Distilled & Award-Winning Mocktail & Cocktail Ingredient | For Halfsies or Fully Spiritless | Non-GMO & Vegan | 750 ml Bottle,$35.99 ,#35,https://www.amazon.com/Best-Sellers-Grocery-Gourmet-Food-Alcoholic-Beverages/zgbs/grocery/2983371011/ref=zg_bs_nav_grocery_1
"Hiball Energy Seltzer Water, Caffeinated Sparkling Water Made with Organic Caffeine, Zero Calorie, Sugar Free (16 Fl Oz Pack of 8), Watermelon",$25.19 ,#38,https://www.amazon.com/Best-Sellers-Grocery-Gourmet-Food-Alcoholic-Beverages/zgbs/grocery/2983371011/ref=zg_bs_nav_grocery_1
"Angostura Aromatic Cocktail Bitters, 16 Fl Oz",$30.68 ,#17,https://www.amazon.com/Best-Sellers-Grocery-Gourmet-Food-Alcoholic-Beverages/zgbs/grocery/2983371011/ref=zg_bs_nav_grocery_1
"Bartesian Cosmopolitan, Margarita, and Old Fashioned Cocktail Mixer Capsules, Pack of 18 Cocktail Capsules, for Bartesian Premium Cocktail Maker (55405)",$42.99 ,#20,https://www.amazon.com/Best-Sellers-Grocery-Gourmet-Food-Alcoholic-Beverages/zgbs/grocery/2983371011/ref=zg_bs_nav_grocery_1
"St.Regis Chardonnay (Non Alcoholic Wine), 25.4 Fl Oz",$12.58 ,#29,https://www.amazon.com/Best-Sellers-Grocery-Gourmet-Food-Alcoholic-Beverages/zgbs/grocery/2983371011/ref=zg_bs_nav_grocery_1
St Regis Cabernet Sauvignon (non alcoholic wine),$13.29 ,#18,https://www.amazon.com/Best-Sellers-Grocery-Gourmet-Food-Alcoholic-Beverages/zgbs/grocery/2983371011/ref=zg_bs_nav_grocery_1
Peychaud's Aromatic Cocktail Bitters - 10 Ounce Bottle,$13.30 ,#33,https://www.amazon.com/Best-Sellers-Grocery-Gourmet-Food-Alcoholic-Beverages/zgbs/grocery/2983371011/ref=zg_bs_nav_grocery_1
"RITUAL ZERO PROOF Gin Alternative | Award-Winning Non-Alcoholic Spirit | 25.4 Fl Oz (750ml) | Zero Calories | Keto, Paleo & Low Carb Diet Friendly | Make Delicious Alcohol Free Cocktails",$29.99 ,#25,https://www.amazon.com/Best-Sellers-Grocery-Gourmet-Food-Alcoholic-Beverages/zgbs/grocery/2983371011/ref=zg_bs_nav_grocery_1
"Jordan's Skinny Mixes Margarita, Sugar Free Cocktail Flavoring Mix, 32 Fl Oz",$9.99 ,#28,https://www.amazon.com/Best-Sellers-Grocery-Gourmet-Food-Alcoholic-Beverages/zgbs/grocery/2983371011/ref=zg_bs_nav_grocery_1
"Strongwater Cocktail Bitters Collection - 5 Bitters for Old Fashioned Gift Set - Includes Cherry, Orange, Aromatic, Walnut and Lavender Bitters for Cocktails - 5 Bottles - 3 fl. oz. each)",$19.95 ,#23,https://www.amazon.com/Best-Sellers-Grocery-Gourmet-Food-Alcoholic-Beverages/zgbs/grocery/2983371011/ref=zg_bs_nav_grocery_1
"Waterloo Sparkling Water Variety Pack, 12 Fl Oz Cans - 9 flavors (18 Pack) In Sanisco Box",$25.95 ,#26,https://www.amazon.com/Best-Sellers-Grocery-Gourmet-Food-Alcoholic-Beverages/zgbs/grocery/2983371011/ref=zg_bs_nav_grocery_1
MONDAY Zero Alcohol Gin – A Non-Alcoholic Spirit for the Spirited Ones - 750ml,$39.99 ,#32,https://www.amazon.com/Best-Sellers-Grocery-Gourmet-Food-Alcoholic-Beverages/zgbs/grocery/2983371011/ref=zg_bs_nav_grocery_1
"Seedlip Garden 108 - Non-alcoholic Spirit | Calorie Free, Sugar Free | Spirits Alternative | Alcohol Free Cocktails | 23.7fl oz (700ml)",$31.99 ,#43,https://www.amazon.com/Best-Sellers-Grocery-Gourmet-Food-Alcoholic-Beverages/zgbs/grocery/2983371011/ref=zg_bs_nav_grocery_1
Fee Brothers West Indian Orange Bitters 5oz,$11.21 ,#19,https://www.amazon.com/Best-Sellers-Grocery-Gourmet-Food-Alcoholic-Beverages/zgbs/grocery/2983371011/ref=zg_bs_nav_grocery_1
"Withco Bloody Mary Craft Cocktail Mixer (makes 8 cocktails) with Horseradish, Spices and Ginger Root, just add Vodka, Tequila or Mezcal",$17.99 ,#34,https://www.amazon.com/Best-Sellers-Grocery-Gourmet-Food-Alcoholic-Beverages/zgbs/grocery/2983371011/ref=zg_bs_nav_grocery_1
Proof Syrup - Maple Bacon Flavored - Old Fashioned Cocktail Mixer - 16oz - Make A Perfect Maple Bacon Cocktail Every Time With No Bitters Or Simple Syrup,$39.39 ,#21,https://www.amazon.com/Best-Sellers-Grocery-Gourmet-Food-Alcoholic-Beverages/zgbs/grocery/2983371011/ref=zg_bs_nav_grocery_1
"sodastream Soda Press Organic Ale Flavor Mix, Ginger, 16.9 Fl Oz",$18.90 ,#42,https://www.amazon.com/Best-Sellers-Grocery-Gourmet-Food-Alcoholic-Beverages/zgbs/grocery/2983371011/ref=zg_bs_nav_grocery_1
"Kin Spritz by Kin Euphorics, Non Alcoholic Spirits, Ready to Drink, Adaptogen, Nootropic, Botanical, Fresh Citrus, Hibiscus, Caffeine, Rhodiola Rosea, Awaken the Mind, Uplift the Mood, 8 Fl Oz (4pk)",$19.19 ,#14,https://www.amazon.com/Best-Sellers-Grocery-Gourmet-Food-Alcoholic-Beverages/zgbs/grocery/2983371011/ref=zg_bs_nav_grocery_1
Fee Brothers Aztec Chocolate Cocktail Bitters 5oz,$12.17 ,#40,https://www.amazon.com/Best-Sellers-Grocery-Gourmet-Food-Alcoholic-Beverages/zgbs/grocery/2983371011/ref=zg_bs_nav_grocery_1
"Sunwink Mocktail Tonic 12 Pack | Organic, Non-Alcoholic Sparkling Drink with Plant-Based Ingredients for Relaxation and Digestion support (12 fl oz per Bottle)",$45.00 ,#45,https://www.amazon.com/Best-Sellers-Grocery-Gourmet-Food-Alcoholic-Beverages/zgbs/grocery/2983371011/ref=zg_bs_nav_grocery_1
"Craftmix Cocktail Mixers Blood Orange Mai Tai Flavor, Gift Travel Kit Skinny Natural Low Sugar Calorie Keto Mocktail Juice Drink Mix Set Alcohol Free Skinnie Girl Bitters, Backpacking Camping Beverage",$14.99 ,#46,https://www.amazon.com/Best-Sellers-Grocery-Gourmet-Food-Alcoholic-Beverages/zgbs/grocery/2983371011/ref=zg_bs_nav_grocery_1
Fee Brothers Old Fashion Aromatic Bitters 5oz,$10.99 ,#54,https://www.amazon.com/Best-Sellers-Grocery-Gourmet-Food-Alcoholic-Beverages/zgbs/grocery/2983371011/ref=zg_bs_nav_grocery_1
"Thoughtfully Gifts, Global Cocktail Mixers, 2.3 Fluid Ounces Each, Mixes of Classic Margarita, Cuban Style Mojito, New York Appletini, Pina Colada, Blue Hawaiian, Set of 12(Contains NO Alcohol)",$24.99 ,#63,https://www.amazon.com/Best-Sellers-Grocery-Gourmet-Food-Alcoholic-Beverages/zgbs/grocery/2983371011/ref=zg_bs_nav_grocery_1
"Finest Call Premium Pure Cane Sugar Simple Syrup Mix, 1 Liter Bottle (33.8 Fl Oz), Individually Boxed",$8.00 ,#57,https://www.amazon.com/Best-Sellers-Grocery-Gourmet-Food-Alcoholic-Beverages/zgbs/grocery/2983371011/ref=zg_bs_nav_grocery_1
Woodford Reserve Spiced Cherry Bourbon Barrel Aged Cocktail Bitters - 59ml,$12.00 ,#71,https://www.amazon.com/Best-Sellers-Grocery-Gourmet-Food-Alcoholic-Beverages/zgbs/grocery/2983371011/ref=zg_bs_nav_grocery_1
"Urban Moonshine Original Bitters, Organic & Gluten Free - 8 fl oz",$35.60 ,#56,https://www.amazon.com/Best-Sellers-Grocery-Gourmet-Food-Alcoholic-Beverages/zgbs/grocery/2983371011/ref=zg_bs_nav_grocery_1
Fee Brothers Fee Foam Cocktail Foamer - 5 oz,$10.73 ,#51,https://www.amazon.com/Best-Sellers-Grocery-Gourmet-Food-Alcoholic-Beverages/zgbs/grocery/2983371011/ref=zg_bs_nav_grocery_1
"Thoughtfully Gifts, Champagne Toppers Gift Set, 2.3 Ounces Each, Flavors Include Blood Orange Mimosa, Raspberry Bellini, Mango Mimosa, Grapefruit Bellini, and Mandarin Mimosa, Pack of 5 (NO Alcohol)",$17.99 ,#52,https://www.amazon.com/Best-Sellers-Grocery-Gourmet-Food-Alcoholic-Beverages/zgbs/grocery/2983371011/ref=zg_bs_nav_grocery_1
MONDAY Zero Alcohol Whiskey – A Non-Alcoholic Spirit for the Spirited Ones - 750ml,$44.99 ,#66,https://www.amazon.com/Best-Sellers-Grocery-Gourmet-Food-Alcoholic-Beverages/zgbs/grocery/2983371011/ref=zg_bs_nav_grocery_1
Lyre's American Malt Non-Alcoholic Spirit - Bourbon Style | Award Winning | 23.7 Fl Oz,$35.99 ,#64,https://www.amazon.com/Best-Sellers-Grocery-Gourmet-Food-Alcoholic-Beverages/zgbs/grocery/2983371011/ref=zg_bs_nav_grocery_1
cocktail flavoring mix,,#55,https://www.amazon.com/Best-Sellers-Grocery-Gourmet-Food-Alcoholic-Beverages/zgbs/grocery/2983371011/ref=zg_bs_nav_grocery_1
"OLIPOP - Classic Root Beer Sparkling Tonic, Healthy Soda, Prebiotic Soft Drink, Aids Digestive Health, Contains Prebiotics & 9g of Plant Fiber, Caffeine Free, Low Calorie, Low Sugar (12 oz, 12-Pack)",$36.89 ,#62,https://www.amazon.com/Best-Sellers-Grocery-Gourmet-Food-Alcoholic-Beverages/zgbs/grocery/2983371011/ref=zg_bs_nav_grocery_1
"Hella Cocktail Co. Classic Dry Aromatic Bitters & Soda - 12oz Cans (Case of 12) - Ready to Drink or Use as Cocktail Mixer - Zero Sugar, All Natural Ingredients, Made with Gentian Tincture",$39.95 ,#69,https://www.amazon.com/Best-Sellers-Grocery-Gourmet-Food-Alcoholic-Beverages/zgbs/grocery/2983371011/ref=zg_bs_nav_grocery_1
Boscoli Dirty Martini Olive Juice 25 ounce (Pack of 2),$27.99 ,#53,https://www.amazon.com/Best-Sellers-Grocery-Gourmet-Food-Alcoholic-Beverages/zgbs/grocery/2983371011/ref=zg_bs_nav_grocery_1
"Bartesian Cosmopolitan Cocktail Mixer Capsules, Pack of 8 Cocktail Capsules, for Bartesian Premium Cocktail Maker (55419)",$19.99 ,#72,https://www.amazon.com/Best-Sellers-Grocery-Gourmet-Food-Alcoholic-Beverages/zgbs/grocery/2983371011/ref=zg_bs_nav_grocery_1
Ariel Non-alcoholic Wine Two Pack - Includes Ariel Cabernet and Ariel Chardonnay,$30.99 ,#59,https://www.amazon.com/Best-Sellers-Grocery-Gourmet-Food-Alcoholic-Beverages/zgbs/grocery/2983371011/ref=zg_bs_nav_grocery_1
Lt. Blender's Hurricane in a Bag - Frozen Hurricane Mix with Natural Ingredients - Premade Cocktail Mix for Hurricane Slushies - Each Bag Makes 1/2 Gallon (Pack of 3),$12.99 ,#61,https://www.amazon.com/Best-Sellers-Grocery-Gourmet-Food-Alcoholic-Beverages/zgbs/grocery/2983371011/ref=zg_bs_nav_grocery_1
"Mtn Dew Spark Variety Pack, 3 Flavor Variety, 12oz Cans (18 Pack)",$12.49 ,#65,https://www.amazon.com/Best-Sellers-Grocery-Gourmet-Food-Alcoholic-Beverages/zgbs/grocery/2983371011/ref=zg_bs_nav_grocery_1
Traeger Grills MIX002 Smoked Bloody Mary Mix,$15.99 ,#68,https://www.amazon.com/Best-Sellers-Grocery-Gourmet-Food-Alcoholic-Beverages/zgbs/grocery/2983371011/ref=zg_bs_nav_grocery_1
"RITUAL ZERO PROOF Rum Alternative | Award-Winning Non-Alcoholic Spirit | 25.4 Fl Oz (750ml) | Only 10 Calories | Keto, Paleo & Low Carb Diet Friendly | Make Alcohol Free Cocktails",$29.99 ,#67,https://www.amazon.com/Best-Sellers-Grocery-Gourmet-Food-Alcoholic-Beverages/zgbs/grocery/2983371011/ref=zg_bs_nav_grocery_1
"OLIPOP - Vintage Cola Sparkling Tonic, Healthy Soda, Prebiotic Soft Drink, Aids Digestive Health, Contains Prebiotics & Plant Fiber, 50mg of Green-Tea Caffeine, Low Calorie, Low Sugar (12 oz, 12-Pack)",$33.35 ,#58,https://www.amazon.com/Best-Sellers-Grocery-Gourmet-Food-Alcoholic-Beverages/zgbs/grocery/2983371011/ref=zg_bs_nav_grocery_1
"WOODFORD RESERVE Aromatic Bitters, 2 ML",$9.98 ,#70,https://www.amazon.com/Best-Sellers-Grocery-Gourmet-Food-Alcoholic-Beverages/zgbs/grocery/2983371011/ref=zg_bs_nav_grocery_1
"Fee Brothers Aztec Chocolate Cocktail Bitters, 5 Fl. Oz",$11.99 ,#60,https://www.amazon.com/Best-Sellers-Grocery-Gourmet-Food-Alcoholic-Beverages/zgbs/grocery/2983371011/ref=zg_bs_nav_grocery_1
"Unmuddled Premium Cocktail Mixers, 3 Flavor Variety Pack, 7oz bottle, 12 pack",$19.99 ,#93,https://www.amazon.com/Best-Sellers-Grocery-Gourmet-Food-Alcoholic-Beverages/zgbs/grocery/2983371011/ref=zg_bs_nav_grocery_1
"Baja Bob's Sugar Free ORIGINAL MARGARITA Mix, 1.75L - Cocktail Mixer - Keto Friendly - Low Calorie - Low Carb",$14.99 ,#98,https://www.amazon.com/Best-Sellers-Grocery-Gourmet-Food-Alcoholic-Beverages/zgbs/grocery/2983371011/ref=zg_bs_nav_grocery_1
"Master of Mixes Blue Hawaiian Mix, Ready to Use, 96 oz Low-Profile BigBucket, Individually Boxed",$21.99 ,#92,https://www.amazon.com/Best-Sellers-Grocery-Gourmet-Food-Alcoholic-Beverages/zgbs/grocery/2983371011/ref=zg_bs_nav_grocery_1
"Agalima Organic Authentic Margarita Drink Mix, All Natural, 1 Liter (33.8 Fl Oz) Glass Bottle, Individually Boxed",$14.99 ,#97,https://www.amazon.com/Best-Sellers-Grocery-Gourmet-Food-Alcoholic-Beverages/zgbs/grocery/2983371011/ref=zg_bs_nav_grocery_1
Demitri's Bloody Mary Spiced Rim Salt 4 oz,$9.92 ,#99,https://www.amazon.com/Best-Sellers-Grocery-Gourmet-Food-Alcoholic-Beverages/zgbs/grocery/2983371011/ref=zg_bs_nav_grocery_1
The Old Fashioned Cocktail Kit - The Cocktail Box Co. Premium Cocktail Kits - Make Hand Crafted Cocktails. Great gift for any cocktail lover and makes the perfect travel companion! (1 Kit),$22.99 ,#75,https://www.amazon.com/Best-Sellers-Grocery-Gourmet-Food-Alcoholic-Beverages/zgbs/grocery/2983371011/ref=zg_bs_nav_grocery_1
"Fever-Tree Refreshingly Light Tonic Water, Lower in Calories, No Artificial Sweeteners, Flavorings or Preservatives, 5.07 Fl Oz Each (24 Cans)",$35.20 ,#84,https://www.amazon.com/Best-Sellers-Grocery-Gourmet-Food-Alcoholic-Beverages/zgbs/grocery/2983371011/ref=zg_bs_nav_grocery_1
"Chef'n Emulstir Salad Dressing Mixer, One Size, Arugula/Meringue",$18.00 ,#85,https://www.amazon.com/Best-Sellers-Grocery-Gourmet-Food-Alcoholic-Beverages/zgbs/grocery/2983371011/ref=zg_bs_nav_grocery_1
"Schwepps diet tonic water sleek, 7.5 fl oz, 18 cans",$23.79 ,#86,https://www.amazon.com/Best-Sellers-Grocery-Gourmet-Food-Alcoholic-Beverages/zgbs/grocery/2983371011/ref=zg_bs_nav_grocery_1
"Woodford Reserve Chocolate Bitters, 2 Ounces",$13.15 ,#88,https://www.amazon.com/Best-Sellers-Grocery-Gourmet-Food-Alcoholic-Beverages/zgbs/grocery/2983371011/ref=zg_bs_nav_grocery_1
"Seedlip - Non-Alcoholic Spirits Trio Bundle | Grove 42, Garden 108 and Spice 94 | Calorie Free, Sugar Free | Spirit Alternative | Alcohol Free Cocktails | 23.7 fl oz (Pack of 3, 700ml)",$89.99 ,#87,https://www.amazon.com/Best-Sellers-Grocery-Gourmet-Food-Alcoholic-Beverages/zgbs/grocery/2983371011/ref=zg_bs_nav_grocery_1
WOODFORD RESERVE BITTERS DRAM SET – FIVE PACK (10ML EACH) .2 pack,$24.27 ,#79,https://www.amazon.com/Best-Sellers-Grocery-Gourmet-Food-Alcoholic-Beverages/zgbs/grocery/2983371011/ref=zg_bs_nav_grocery_1
"OLIPOP - Ginger Lemon Sparkling Tonic, Healthy Soda, Prebiotic Soft Drink, Aids Digestive Health, Contains Prebiotics & 9g of Plant Fiber, Caffeine Free, Low Calorie, Low Sugar (12 oz, 12-Pack)",$35.42 ,#73,https://www.amazon.com/Best-Sellers-Grocery-Gourmet-Food-Alcoholic-Beverages/zgbs/grocery/2983371011/ref=zg_bs_nav_grocery_1
